No.     Time        Source                Destination           Protocol Length Info
      1 0.000000    Hewlett-_ca:2b:e8     Broadcast             ARP      60     Who has 10.0.1.14?  Tell 10.0.1.13

Frame 1: 60 bytes on wire (480 bits), 60 bytes captured (480 bits)
Ethernet II, Src: Hewlett-_ca:2b:e8 (00:25:b3:ca:2b:e8), Dst: Broadcast (ff:ff:ff:ff:ff:ff)
Address Resolution Protocol (request)

No.     Time        Source                Destination           Protocol Length Info
      2 0.000455    Hewlett-_0d:8d:55     Hewlett-_ca:2b:e8     ARP      60     10.0.1.14 is at 00:25:b3:0d:8d:55

Frame 2: 60 bytes on wire (480 bits), 60 bytes captured (480 bits)
Ethernet II, Src: Hewlett-_0d:8d:55 (00:25:b3:0d:8d:55), Dst: Hewlett-_ca:2b:e8 (00:25:b3:ca:2b:e8)
Address Resolution Protocol (reply)

No.     Time        Source                Destination           Protocol Length Info
      3 0.000726    10.0.1.13             10.0.1.14             SSH      114    Encrypted request packet len=48

Frame 3: 114 bytes on wire (912 bits), 114 bytes captured (912 bits)
Ethernet II, Src: Hewlett-_ca:2b:e8 (00:25:b3:ca:2b:e8), Dst: Hewlett-_0d:8d:55 (00:25:b3:0d:8d:55)
Internet Protocol Version 4, Src: 10.0.1.13 (10.0.1.13), Dst: 10.0.1.14 (10.0.1.14)
Transmission Control Protocol, Src Port: 59519 (59519), Dst Port: ssh (22), Seq: 1, Ack: 1, Len: 48
SSH Protocol

No.     Time        Source                Destination           Protocol Length Info
      4 0.001181    10.0.1.14             10.0.1.13             SSH      114    Encrypted response packet len=48

Frame 4: 114 bytes on wire (912 bits), 114 bytes captured (912 bits)
Ethernet II, Src: Hewlett-_0d:8d:55 (00:25:b3:0d:8d:55), Dst: Hewlett-_ca:2b:e8 (00:25:b3:ca:2b:e8)
Internet Protocol Version 4, Src: 10.0.1.14 (10.0.1.14), Dst: 10.0.1.13 (10.0.1.13)
Transmission Control Protocol, Src Port: ssh (22), Dst Port: 59519 (59519), Seq: 1, Ack: 49, Len: 48
SSH Protocol

No.     Time        Source                Destination           Protocol Length Info
      5 0.001457    10.0.1.13             10.0.1.14             TCP      66     59519 > ssh [ACK] Seq=49 Ack=49 Win=171 Len=0 TSval=2386270 TSecr=2409523

Frame 5: 66 bytes on wire (528 bits), 66 bytes captured (528 bits)
Ethernet II, Src: Hewlett-_ca:2b:e8 (00:25:b3:ca:2b:e8), Dst: Hewlett-_0d:8d:55 (00:25:b3:0d:8d:55)
Internet Protocol Version 4, Src: 10.0.1.13 (10.0.1.13), Dst: 10.0.1.14 (10.0.1.14)
Transmission Control Protocol, Src Port: 59519 (59519), Dst Port: ssh (22), Seq: 49, Ack: 49, Len: 0

No.     Time        Source                Destination           Protocol Length Info
      6 0.103873    10.0.1.13             10.0.1.14             SSH      114    Encrypted request packet len=48

Frame 6: 114 bytes on wire (912 bits), 114 bytes captured (912 bits)
Ethernet II, Src: Hewlett-_ca:2b:e8 (00:25:b3:ca:2b:e8), Dst: Hewlett-_0d:8d:55 (00:25:b3:0d:8d:55)
Internet Protocol Version 4, Src: 10.0.1.13 (10.0.1.13), Dst: 10.0.1.14 (10.0.1.14)
Transmission Control Protocol, Src Port: 59519 (59519), Dst Port: ssh (22), Seq: 49, Ack: 49, Len: 48
SSH Protocol

No.     Time        Source                Destination           Protocol Length Info
      7 0.104332    10.0.1.14             10.0.1.13             SSH      114    Encrypted response packet len=48

Frame 7: 114 bytes on wire (912 bits), 114 bytes captured (912 bits)
Ethernet II, Src: Hewlett-_0d:8d:55 (00:25:b3:0d:8d:55), Dst: Hewlett-_ca:2b:e8 (00:25:b3:ca:2b:e8)
Internet Protocol Version 4, Src: 10.0.1.14 (10.0.1.14), Dst: 10.0.1.13 (10.0.1.13)
Transmission Control Protocol, Src Port: ssh (22), Dst Port: 59519 (59519), Seq: 49, Ack: 97, Len: 48
SSH Protocol

No.     Time        Source                Destination           Protocol Length Info
      8 0.104608    10.0.1.13             10.0.1.14             TCP      66     59519 > ssh [ACK] Seq=97 Ack=97 Win=171 Len=0 TSval=2386373 TSecr=2409626

Frame 8: 66 bytes on wire (528 bits), 66 bytes captured (528 bits)
Ethernet II, Src: Hewlett-_ca:2b:e8 (00:25:b3:ca:2b:e8), Dst: Hewlett-_0d:8d:55 (00:25:b3:0d:8d:55)
Internet Protocol Version 4, Src: 10.0.1.13 (10.0.1.13), Dst: 10.0.1.14 (10.0.1.14)
Transmission Control Protocol, Src Port: 59519 (59519), Dst Port: ssh (22), Seq: 97, Ack: 97, Len: 0

No.     Time        Source                Destination           Protocol Length Info
      9 0.352010    10.0.1.13             10.0.1.14             SSH      114    Encrypted request packet len=48

Frame 9: 114 bytes on wire (912 bits), 114 bytes captured (912 bits)
Ethernet II, Src: Hewlett-_ca:2b:e8 (00:25:b3:ca:2b:e8), Dst: Hewlett-_0d:8d:55 (00:25:b3:0d:8d:55)
Internet Protocol Version 4, Src: 10.0.1.13 (10.0.1.13), Dst: 10.0.1.14 (10.0.1.14)
Transmission Control Protocol, Src Port: 59519 (59519), Dst Port: ssh (22), Seq: 97, Ack: 97, Len: 48
SSH Protocol

No.     Time        Source                Destination           Protocol Length Info
     10 0.352264    10.0.1.14             10.0.1.13             SSH      114    Encrypted response packet len=48

Frame 10: 114 bytes on wire (912 bits), 114 bytes captured (912 bits)
Ethernet II, Src: Hewlett-_0d:8d:55 (00:25:b3:0d:8d:55), Dst: Hewlett-_ca:2b:e8 (00:25:b3:ca:2b:e8)
Internet Protocol Version 4, Src: 10.0.1.14 (10.0.1.14), Dst: 10.0.1.13 (10.0.1.13)
Transmission Control Protocol, Src Port: ssh (22), Dst Port: 59519 (59519), Seq: 97, Ack: 145, Len: 48
SSH Protocol

No.     Time        Source                Destination           Protocol Length Info
     11 0.352538    10.0.1.13             10.0.1.14             TCP      66     59519 > ssh [ACK] Seq=145 Ack=145 Win=171 Len=0 TSval=2386621 TSecr=2409874

Frame 11: 66 bytes on wire (528 bits), 66 bytes captured (528 bits)
Ethernet II, Src: Hewlett-_ca:2b:e8 (00:25:b3:ca:2b:e8), Dst: Hewlett-_0d:8d:55 (00:25:b3:0d:8d:55)
Internet Protocol Version 4, Src: 10.0.1.13 (10.0.1.13), Dst: 10.0.1.14 (10.0.1.14)
Transmission Control Protocol, Src Port: 59519 (59519), Dst Port: ssh (22), Seq: 145, Ack: 145, Len: 0

No.     Time        Source                Destination           Protocol Length Info
     12 0.479879    10.0.1.13             10.0.1.14             SSH      114    Encrypted request packet len=48

Frame 12: 114 bytes on wire (912 bits), 114 bytes captured (912 bits)
Ethernet II, Src: Hewlett-_ca:2b:e8 (00:25:b3:ca:2b:e8), Dst: Hewlett-_0d:8d:55 (00:25:b3:0d:8d:55)
Internet Protocol Version 4, Src: 10.0.1.13 (10.0.1.13), Dst: 10.0.1.14 (10.0.1.14)
Transmission Control Protocol, Src Port: 59519 (59519), Dst Port: ssh (22), Seq: 145, Ack: 145, Len: 48
SSH Protocol

No.     Time        Source                Destination           Protocol Length Info
     13 0.480248    10.0.1.14             10.0.1.13             SSH      114    Encrypted response packet len=48

Frame 13: 114 bytes on wire (912 bits), 114 bytes captured (912 bits)
Ethernet II, Src: Hewlett-_0d:8d:55 (00:25:b3:0d:8d:55), Dst: Hewlett-_ca:2b:e8 (00:25:b3:ca:2b:e8)
Internet Protocol Version 4, Src: 10.0.1.14 (10.0.1.14), Dst: 10.0.1.13 (10.0.1.13)
Transmission Control Protocol, Src Port: ssh (22), Dst Port: 59519 (59519), Seq: 145, Ack: 193, Len: 48
SSH Protocol

No.     Time        Source                Destination           Protocol Length Info
     14 0.480522    10.0.1.13             10.0.1.14             TCP      66     59519 > ssh [ACK] Seq=193 Ack=193 Win=171 Len=0 TSval=2386749 TSecr=2410002

Frame 14: 66 bytes on wire (528 bits), 66 bytes captured (528 bits)
Ethernet II, Src: Hewlett-_ca:2b:e8 (00:25:b3:ca:2b:e8), Dst: Hewlett-_0d:8d:55 (00:25:b3:0d:8d:55)
Internet Protocol Version 4, Src: 10.0.1.13 (10.0.1.13), Dst: 10.0.1.14 (10.0.1.14)
Transmission Control Protocol, Src Port: 59519 (59519), Dst Port: ssh (22), Seq: 193, Ack: 193, Len: 0

No.     Time        Source                Destination           Protocol Length Info
     15 0.631885    10.0.1.13             10.0.1.14             SSH      114    Encrypted request packet len=48

Frame 15: 114 bytes on wire (912 bits), 114 bytes captured (912 bits)
Ethernet II, Src: Hewlett-_ca:2b:e8 (00:25:b3:ca:2b:e8), Dst: Hewlett-_0d:8d:55 (00:25:b3:0d:8d:55)
Internet Protocol Version 4, Src: 10.0.1.13 (10.0.1.13), Dst: 10.0.1.14 (10.0.1.14)
Transmission Control Protocol, Src Port: 59519 (59519), Dst Port: ssh (22), Seq: 193, Ack: 193, Len: 48
SSH Protocol

No.     Time        Source                Destination           Protocol Length Info
     16 0.632308    10.0.1.14             10.0.1.13             SSH      114    Encrypted response packet len=48

Frame 16: 114 bytes on wire (912 bits), 114 bytes captured (912 bits)
Ethernet II, Src: Hewlett-_0d:8d:55 (00:25:b3:0d:8d:55), Dst: Hewlett-_ca:2b:e8 (00:25:b3:ca:2b:e8)
Internet Protocol Version 4, Src: 10.0.1.14 (10.0.1.14), Dst: 10.0.1.13 (10.0.1.13)
Transmission Control Protocol, Src Port: ssh (22), Dst Port: 59519 (59519), Seq: 193, Ack: 241, Len: 48
SSH Protocol

No.     Time        Source                Destination           Protocol Length Info
     17 0.632582    10.0.1.13             10.0.1.14             TCP      66     59519 > ssh [ACK] Seq=241 Ack=241 Win=171 Len=0 TSval=2386901 TSecr=2410154

Frame 17: 66 bytes on wire (528 bits), 66 bytes captured (528 bits)
Ethernet II, Src: Hewlett-_ca:2b:e8 (00:25:b3:ca:2b:e8), Dst: Hewlett-_0d:8d:55 (00:25:b3:0d:8d:55)
Internet Protocol Version 4, Src: 10.0.1.13 (10.0.1.13), Dst: 10.0.1.14 (10.0.1.14)
Transmission Control Protocol, Src Port: 59519 (59519), Dst Port: ssh (22), Seq: 241, Ack: 241, Len: 0

No.     Time        Source                Destination           Protocol Length Info
     18 0.783817    10.0.1.13             10.0.1.14             SSH      114    Encrypted request packet len=48

Frame 18: 114 bytes on wire (912 bits), 114 bytes captured (912 bits)
Ethernet II, Src: Hewlett-_ca:2b:e8 (00:25:b3:ca:2b:e8), Dst: Hewlett-_0d:8d:55 (00:25:b3:0d:8d:55)
Internet Protocol Version 4, Src: 10.0.1.13 (10.0.1.13), Dst: 10.0.1.14 (10.0.1.14)
Transmission Control Protocol, Src Port: 59519 (59519), Dst Port: ssh (22), Seq: 241, Ack: 241, Len: 48
SSH Protocol

No.     Time        Source                Destination           Protocol Length Info
     19 0.784233    10.0.1.14             10.0.1.13             SSH      114    Encrypted response packet len=48

Frame 19: 114 bytes on wire (912 bits), 114 bytes captured (912 bits)
Ethernet II, Src: Hewlett-_0d:8d:55 (00:25:b3:0d:8d:55), Dst: Hewlett-_ca:2b:e8 (00:25:b3:ca:2b:e8)
Internet Protocol Version 4, Src: 10.0.1.14 (10.0.1.14), Dst: 10.0.1.13 (10.0.1.13)
Transmission Control Protocol, Src Port: ssh (22), Dst Port: 59519 (59519), Seq: 241, Ack: 289, Len: 48
SSH Protocol

No.     Time        Source                Destination           Protocol Length Info
     20 0.784509    10.0.1.13             10.0.1.14             TCP      66     59519 > ssh [ACK] Seq=289 Ack=289 Win=171 Len=0 TSval=2387053 TSecr=2410306

Frame 20: 66 bytes on wire (528 bits), 66 bytes captured (528 bits)
Ethernet II, Src: Hewlett-_ca:2b:e8 (00:25:b3:ca:2b:e8), Dst: Hewlett-_0d:8d:55 (00:25:b3:0d:8d:55)
Internet Protocol Version 4, Src: 10.0.1.13 (10.0.1.13), Dst: 10.0.1.14 (10.0.1.14)
Transmission Control Protocol, Src Port: 59519 (59519), Dst Port: ssh (22), Seq: 289, Ack: 289, Len: 0

No.     Time        Source                Destination           Protocol Length Info
     21 0.863952    10.0.1.13             10.0.1.14             SSH      114    Encrypted request packet len=48

Frame 21: 114 bytes on wire (912 bits), 114 bytes captured (912 bits)
Ethernet II, Src: Hewlett-_ca:2b:e8 (00:25:b3:ca:2b:e8), Dst: Hewlett-_0d:8d:55 (00:25:b3:0d:8d:55)
Internet Protocol Version 4, Src: 10.0.1.13 (10.0.1.13), Dst: 10.0.1.14 (10.0.1.14)
Transmission Control Protocol, Src Port: 59519 (59519), Dst Port: ssh (22), Seq: 289, Ack: 289, Len: 48
SSH Protocol

No.     Time        Source                Destination           Protocol Length Info
     22 0.864431    10.0.1.14             10.0.1.13             SSH      114    Encrypted response packet len=48

Frame 22: 114 bytes on wire (912 bits), 114 bytes captured (912 bits)
Ethernet II, Src: Hewlett-_0d:8d:55 (00:25:b3:0d:8d:55), Dst: Hewlett-_ca:2b:e8 (00:25:b3:ca:2b:e8)
Internet Protocol Version 4, Src: 10.0.1.14 (10.0.1.14), Dst: 10.0.1.13 (10.0.1.13)
Transmission Control Protocol, Src Port: ssh (22), Dst Port: 59519 (59519), Seq: 289, Ack: 337, Len: 48
SSH Protocol

No.     Time        Source                Destination           Protocol Length Info
     23 0.864704    10.0.1.13             10.0.1.14             TCP      66     59519 > ssh [ACK] Seq=337 Ack=337 Win=171 Len=0 TSval=2387133 TSecr=2410386

Frame 23: 66 bytes on wire (528 bits), 66 bytes captured (528 bits)
Ethernet II, Src: Hewlett-_ca:2b:e8 (00:25:b3:ca:2b:e8), Dst: Hewlett-_0d:8d:55 (00:25:b3:0d:8d:55)
Internet Protocol Version 4, Src: 10.0.1.13 (10.0.1.13), Dst: 10.0.1.14 (10.0.1.14)
Transmission Control Protocol, Src Port: 59519 (59519), Dst Port: ssh (22), Seq: 337, Ack: 337, Len: 0

No.     Time        Source                Destination           Protocol Length Info
     24 1.119833    10.0.1.13             10.0.1.14             SSH      114    Encrypted request packet len=48

Frame 24: 114 bytes on wire (912 bits), 114 bytes captured (912 bits)
Ethernet II, Src: Hewlett-_ca:2b:e8 (00:25:b3:ca:2b:e8), Dst: Hewlett-_0d:8d:55 (00:25:b3:0d:8d:55)
Internet Protocol Version 4, Src: 10.0.1.13 (10.0.1.13), Dst: 10.0.1.14 (10.0.1.14)
Transmission Control Protocol, Src Port: 59519 (59519), Dst Port: ssh (22), Seq: 337, Ack: 337, Len: 48
SSH Protocol

No.     Time        Source                Destination           Protocol Length Info
     25 1.120468    10.0.1.14             10.0.1.13             SSH      114    Encrypted response packet len=48

Frame 25: 114 bytes on wire (912 bits), 114 bytes captured (912 bits)
Ethernet II, Src: Hewlett-_0d:8d:55 (00:25:b3:0d:8d:55), Dst: Hewlett-_ca:2b:e8 (00:25:b3:ca:2b:e8)
Internet Protocol Version 4, Src: 10.0.1.14 (10.0.1.14), Dst: 10.0.1.13 (10.0.1.13)
Transmission Control Protocol, Src Port: ssh (22), Dst Port: 59519 (59519), Seq: 337, Ack: 385, Len: 48
SSH Protocol

No.     Time        Source                Destination           Protocol Length Info
     26 1.120720    10.0.1.13             10.0.1.14             TCP      66     59519 > ssh [ACK] Seq=385 Ack=385 Win=171 Len=0 TSval=2387389 TSecr=2410642

Frame 26: 66 bytes on wire (528 bits), 66 bytes captured (528 bits)
Ethernet II, Src: Hewlett-_ca:2b:e8 (00:25:b3:ca:2b:e8), Dst: Hewlett-_0d:8d:55 (00:25:b3:0d:8d:55)
Internet Protocol Version 4, Src: 10.0.1.13 (10.0.1.13), Dst: 10.0.1.14 (10.0.1.14)
Transmission Control Protocol, Src Port: 59519 (59519), Dst Port: ssh (22), Seq: 385, Ack: 385, Len: 0

No.     Time        Source                Destination           Protocol Length Info
     27 1.335842    10.0.1.13             10.0.1.14             SSH      114    Encrypted request packet len=48

Frame 27: 114 bytes on wire (912 bits), 114 bytes captured (912 bits)
Ethernet II, Src: Hewlett-_ca:2b:e8 (00:25:b3:ca:2b:e8), Dst: Hewlett-_0d:8d:55 (00:25:b3:0d:8d:55)
Internet Protocol Version 4, Src: 10.0.1.13 (10.0.1.13), Dst: 10.0.1.14 (10.0.1.14)
Transmission Control Protocol, Src Port: 59519 (59519), Dst Port: ssh (22), Seq: 385, Ack: 385, Len: 48
SSH Protocol

No.     Time        Source                Destination           Protocol Length Info
     28 1.336312    10.0.1.14             10.0.1.13             SSH      114    Encrypted response packet len=48

Frame 28: 114 bytes on wire (912 bits), 114 bytes captured (912 bits)
Ethernet II, Src: Hewlett-_0d:8d:55 (00:25:b3:0d:8d:55), Dst: Hewlett-_ca:2b:e8 (00:25:b3:ca:2b:e8)
Internet Protocol Version 4, Src: 10.0.1.14 (10.0.1.14), Dst: 10.0.1.13 (10.0.1.13)
Transmission Control Protocol, Src Port: ssh (22), Dst Port: 59519 (59519), Seq: 385, Ack: 433, Len: 48
SSH Protocol

No.     Time        Source                Destination           Protocol Length Info
     29 1.336588    10.0.1.13             10.0.1.14             TCP      66     59519 > ssh [ACK] Seq=433 Ack=433 Win=171 Len=0 TSval=2387605 TSecr=2410858

Frame 29: 66 bytes on wire (528 bits), 66 bytes captured (528 bits)
Ethernet II, Src: Hewlett-_ca:2b:e8 (00:25:b3:ca:2b:e8), Dst: Hewlett-_0d:8d:55 (00:25:b3:0d:8d:55)
Internet Protocol Version 4, Src: 10.0.1.13 (10.0.1.13), Dst: 10.0.1.14 (10.0.1.14)
Transmission Control Protocol, Src Port: 59519 (59519), Dst Port: ssh (22), Seq: 433, Ack: 433, Len: 0

No.     Time        Source                Destination           Protocol Length Info
     30 1.568034    10.0.1.13             10.0.1.14             SSH      114    Encrypted request packet len=48

Frame 30: 114 bytes on wire (912 bits), 114 bytes captured (912 bits)
Ethernet II, Src: Hewlett-_ca:2b:e8 (00:25:b3:ca:2b:e8), Dst: Hewlett-_0d:8d:55 (00:25:b3:0d:8d:55)
Internet Protocol Version 4, Src: 10.0.1.13 (10.0.1.13), Dst: 10.0.1.14 (10.0.1.14)
Transmission Control Protocol, Src Port: 59519 (59519), Dst Port: ssh (22), Seq: 433, Ack: 433, Len: 48
SSH Protocol

No.     Time        Source                Destination           Protocol Length Info
     31 1.568299    10.0.1.14             10.0.1.13             SSH      114    Encrypted response packet len=48

Frame 31: 114 bytes on wire (912 bits), 114 bytes captured (912 bits)
Ethernet II, Src: Hewlett-_0d:8d:55 (00:25:b3:0d:8d:55), Dst: Hewlett-_ca:2b:e8 (00:25:b3:ca:2b:e8)
Internet Protocol Version 4, Src: 10.0.1.14 (10.0.1.14), Dst: 10.0.1.13 (10.0.1.13)
Transmission Control Protocol, Src Port: ssh (22), Dst Port: 59519 (59519), Seq: 433, Ack: 481, Len: 48
SSH Protocol

No.     Time        Source                Destination           Protocol Length Info
     32 1.568574    10.0.1.13             10.0.1.14             TCP      66     59519 > ssh [ACK] Seq=481 Ack=481 Win=171 Len=0 TSval=2387837 TSecr=2411090

Frame 32: 66 bytes on wire (528 bits), 66 bytes captured (528 bits)
Ethernet II, Src: Hewlett-_ca:2b:e8 (00:25:b3:ca:2b:e8), Dst: Hewlett-_0d:8d:55 (00:25:b3:0d:8d:55)
Internet Protocol Version 4, Src: 10.0.1.13 (10.0.1.13), Dst: 10.0.1.14 (10.0.1.14)
Transmission Control Protocol, Src Port: 59519 (59519), Dst Port: ssh (22), Seq: 481, Ack: 481, Len: 0

No.     Time        Source                Destination           Protocol Length Info
     33 1.767844    10.0.1.13             10.0.1.14             SSH      114    Encrypted request packet len=48

Frame 33: 114 bytes on wire (912 bits), 114 bytes captured (912 bits)
Ethernet II, Src: Hewlett-_ca:2b:e8 (00:25:b3:ca:2b:e8), Dst: Hewlett-_0d:8d:55 (00:25:b3:0d:8d:55)
Internet Protocol Version 4, Src: 10.0.1.13 (10.0.1.13), Dst: 10.0.1.14 (10.0.1.14)
Transmission Control Protocol, Src Port: 59519 (59519), Dst Port: ssh (22), Seq: 481, Ack: 481, Len: 48
SSH Protocol

No.     Time        Source                Destination           Protocol Length Info
     34 1.768264    10.0.1.14             10.0.1.13             SSH      114    Encrypted response packet len=48

Frame 34: 114 bytes on wire (912 bits), 114 bytes captured (912 bits)
Ethernet II, Src: Hewlett-_0d:8d:55 (00:25:b3:0d:8d:55), Dst: Hewlett-_ca:2b:e8 (00:25:b3:ca:2b:e8)
Internet Protocol Version 4, Src: 10.0.1.14 (10.0.1.14), Dst: 10.0.1.13 (10.0.1.13)
Transmission Control Protocol, Src Port: ssh (22), Dst Port: 59519 (59519), Seq: 481, Ack: 529, Len: 48
SSH Protocol

No.     Time        Source                Destination           Protocol Length Info
     35 1.768536    10.0.1.13             10.0.1.14             TCP      66     59519 > ssh [ACK] Seq=529 Ack=529 Win=171 Len=0 TSval=2388037 TSecr=2411290

Frame 35: 66 bytes on wire (528 bits), 66 bytes captured (528 bits)
Ethernet II, Src: Hewlett-_ca:2b:e8 (00:25:b3:ca:2b:e8), Dst: Hewlett-_0d:8d:55 (00:25:b3:0d:8d:55)
Internet Protocol Version 4, Src: 10.0.1.13 (10.0.1.13), Dst: 10.0.1.14 (10.0.1.14)
Transmission Control Protocol, Src Port: 59519 (59519), Dst Port: ssh (22), Seq: 529, Ack: 529, Len: 0

No.     Time        Source                Destination           Protocol Length Info
     36 1.903901    10.0.1.13             10.0.1.14             SSH      114    Encrypted request packet len=48

Frame 36: 114 bytes on wire (912 bits), 114 bytes captured (912 bits)
Ethernet II, Src: Hewlett-_ca:2b:e8 (00:25:b3:ca:2b:e8), Dst: Hewlett-_0d:8d:55 (00:25:b3:0d:8d:55)
Internet Protocol Version 4, Src: 10.0.1.13 (10.0.1.13), Dst: 10.0.1.14 (10.0.1.14)
Transmission Control Protocol, Src Port: 59519 (59519), Dst Port: ssh (22), Seq: 529, Ack: 529, Len: 48
SSH Protocol

No.     Time        Source                Destination           Protocol Length Info
     37 1.904275    10.0.1.14             10.0.1.13             SSH      114    Encrypted response packet len=48

Frame 37: 114 bytes on wire (912 bits), 114 bytes captured (912 bits)
Ethernet II, Src: Hewlett-_0d:8d:55 (00:25:b3:0d:8d:55), Dst: Hewlett-_ca:2b:e8 (00:25:b3:ca:2b:e8)
Internet Protocol Version 4, Src: 10.0.1.14 (10.0.1.14), Dst: 10.0.1.13 (10.0.1.13)
Transmission Control Protocol, Src Port: ssh (22), Dst Port: 59519 (59519), Seq: 529, Ack: 577, Len: 48
SSH Protocol

No.     Time        Source                Destination           Protocol Length Info
     38 1.904551    10.0.1.13             10.0.1.14             TCP      66     59519 > ssh [ACK] Seq=577 Ack=577 Win=171 Len=0 TSval=2388173 TSecr=2411426

Frame 38: 66 bytes on wire (528 bits), 66 bytes captured (528 bits)
Ethernet II, Src: Hewlett-_ca:2b:e8 (00:25:b3:ca:2b:e8), Dst: Hewlett-_0d:8d:55 (00:25:b3:0d:8d:55)
Internet Protocol Version 4, Src: 10.0.1.13 (10.0.1.13), Dst: 10.0.1.14 (10.0.1.14)
Transmission Control Protocol, Src Port: 59519 (59519), Dst Port: ssh (22), Seq: 577, Ack: 577, Len: 0

No.     Time        Source                Destination           Protocol Length Info
     39 2.103848    10.0.1.13             10.0.1.14             SSH      114    Encrypted request packet len=48

Frame 39: 114 bytes on wire (912 bits), 114 bytes captured (912 bits)
Ethernet II, Src: Hewlett-_ca:2b:e8 (00:25:b3:ca:2b:e8), Dst: Hewlett-_0d:8d:55 (00:25:b3:0d:8d:55)
Internet Protocol Version 4, Src: 10.0.1.13 (10.0.1.13), Dst: 10.0.1.14 (10.0.1.14)
Transmission Control Protocol, Src Port: 59519 (59519), Dst Port: ssh (22), Seq: 577, Ack: 577, Len: 48
SSH Protocol

No.     Time        Source                Destination           Protocol Length Info
     40 2.104310    10.0.1.14             10.0.1.13             SSH      114    Encrypted response packet len=48

Frame 40: 114 bytes on wire (912 bits), 114 bytes captured (912 bits)
Ethernet II, Src: Hewlett-_0d:8d:55 (00:25:b3:0d:8d:55), Dst: Hewlett-_ca:2b:e8 (00:25:b3:ca:2b:e8)
Internet Protocol Version 4, Src: 10.0.1.14 (10.0.1.14), Dst: 10.0.1.13 (10.0.1.13)
Transmission Control Protocol, Src Port: ssh (22), Dst Port: 59519 (59519), Seq: 577, Ack: 625, Len: 48
SSH Protocol

No.     Time        Source                Destination           Protocol Length Info
     41 2.104586    10.0.1.13             10.0.1.14             TCP      66     59519 > ssh [ACK] Seq=625 Ack=625 Win=171 Len=0 TSval=2388373 TSecr=2411626

Frame 41: 66 bytes on wire (528 bits), 66 bytes captured (528 bits)
Ethernet II, Src: Hewlett-_ca:2b:e8 (00:25:b3:ca:2b:e8), Dst: Hewlett-_0d:8d:55 (00:25:b3:0d:8d:55)
Internet Protocol Version 4, Src: 10.0.1.13 (10.0.1.13), Dst: 10.0.1.14 (10.0.1.14)
Transmission Control Protocol, Src Port: 59519 (59519), Dst Port: ssh (22), Seq: 625, Ack: 625, Len: 0

No.     Time        Source                Destination           Protocol Length Info
     42 2.215915    10.0.1.13             10.0.1.14             SSH      114    Encrypted request packet len=48

Frame 42: 114 bytes on wire (912 bits), 114 bytes captured (912 bits)
Ethernet II, Src: Hewlett-_ca:2b:e8 (00:25:b3:ca:2b:e8), Dst: Hewlett-_0d:8d:55 (00:25:b3:0d:8d:55)
Internet Protocol Version 4, Src: 10.0.1.13 (10.0.1.13), Dst: 10.0.1.14 (10.0.1.14)
Transmission Control Protocol, Src Port: 59519 (59519), Dst Port: ssh (22), Seq: 625, Ack: 625, Len: 48
SSH Protocol

No.     Time        Source                Destination           Protocol Length Info
     43 2.216363    10.0.1.14             10.0.1.13             SSH      114    Encrypted response packet len=48

Frame 43: 114 bytes on wire (912 bits), 114 bytes captured (912 bits)
Ethernet II, Src: Hewlett-_0d:8d:55 (00:25:b3:0d:8d:55), Dst: Hewlett-_ca:2b:e8 (00:25:b3:ca:2b:e8)
Internet Protocol Version 4, Src: 10.0.1.14 (10.0.1.14), Dst: 10.0.1.13 (10.0.1.13)
Transmission Control Protocol, Src Port: ssh (22), Dst Port: 59519 (59519), Seq: 625, Ack: 673, Len: 48
SSH Protocol

No.     Time        Source                Destination           Protocol Length Info
     44 2.216637    10.0.1.13             10.0.1.14             TCP      66     59519 > ssh [ACK] Seq=673 Ack=673 Win=171 Len=0 TSval=2388485 TSecr=2411738

Frame 44: 66 bytes on wire (528 bits), 66 bytes captured (528 bits)
Ethernet II, Src: Hewlett-_ca:2b:e8 (00:25:b3:ca:2b:e8), Dst: Hewlett-_0d:8d:55 (00:25:b3:0d:8d:55)
Internet Protocol Version 4, Src: 10.0.1.13 (10.0.1.13), Dst: 10.0.1.14 (10.0.1.14)
Transmission Control Protocol, Src Port: 59519 (59519), Dst Port: ssh (22), Seq: 673, Ack: 673, Len: 0

No.     Time        Source                Destination           Protocol Length Info
     45 2.927928    10.0.1.13             10.0.1.14             SSH      114    Encrypted request packet len=48

Frame 45: 114 bytes on wire (912 bits), 114 bytes captured (912 bits)
Ethernet II, Src: Hewlett-_ca:2b:e8 (00:25:b3:ca:2b:e8), Dst: Hewlett-_0d:8d:55 (00:25:b3:0d:8d:55)
Internet Protocol Version 4, Src: 10.0.1.13 (10.0.1.13), Dst: 10.0.1.14 (10.0.1.14)
Transmission Control Protocol, Src Port: 59519 (59519), Dst Port: ssh (22), Seq: 673, Ack: 673, Len: 48
SSH Protocol

No.     Time        Source                Destination           Protocol Length Info
     46 2.928951    10.0.1.14             10.0.1.13             SSH      114    Encrypted response packet len=48

Frame 46: 114 bytes on wire (912 bits), 114 bytes captured (912 bits)
Ethernet II, Src: Hewlett-_0d:8d:55 (00:25:b3:0d:8d:55), Dst: Hewlett-_ca:2b:e8 (00:25:b3:ca:2b:e8)
Internet Protocol Version 4, Src: 10.0.1.14 (10.0.1.14), Dst: 10.0.1.13 (10.0.1.13)
Transmission Control Protocol, Src Port: ssh (22), Dst Port: 59519 (59519), Seq: 673, Ack: 721, Len: 48
SSH Protocol

No.     Time        Source                Destination           Protocol Length Info
     47 2.929224    10.0.1.13             10.0.1.14             TCP      66     59519 > ssh [ACK] Seq=721 Ack=721 Win=171 Len=0 TSval=2389198 TSecr=2412450

Frame 47: 66 bytes on wire (528 bits), 66 bytes captured (528 bits)
Ethernet II, Src: Hewlett-_ca:2b:e8 (00:25:b3:ca:2b:e8), Dst: Hewlett-_0d:8d:55 (00:25:b3:0d:8d:55)
Internet Protocol Version 4, Src: 10.0.1.13 (10.0.1.13), Dst: 10.0.1.14 (10.0.1.14)
Transmission Control Protocol, Src Port: 59519 (59519), Dst Port: ssh (22), Seq: 721, Ack: 721, Len: 0

No.     Time        Source                Destination           Protocol Length Info
     48 3.034457    10.0.1.14             10.0.1.13             SSH      306    Encrypted response packet len=240

Frame 48: 306 bytes on wire (2448 bits), 306 bytes captured (2448 bits)
Ethernet II, Src: Hewlett-_0d:8d:55 (00:25:b3:0d:8d:55), Dst: Hewlett-_ca:2b:e8 (00:25:b3:ca:2b:e8)
Internet Protocol Version 4, Src: 10.0.1.14 (10.0.1.14), Dst: 10.0.1.13 (10.0.1.13)
Transmission Control Protocol, Src Port: ssh (22), Dst Port: 59519 (59519), Seq: 721, Ack: 721, Len: 240
SSH Protocol

No.     Time        Source                Destination           Protocol Length Info
     49 3.034735    10.0.1.13             10.0.1.14             TCP      66     59519 > ssh [ACK] Seq=721 Ack=961 Win=185 Len=0 TSval=2389303 TSecr=2412556

Frame 49: 66 bytes on wire (528 bits), 66 bytes captured (528 bits)
Ethernet II, Src: Hewlett-_ca:2b:e8 (00:25:b3:ca:2b:e8), Dst: Hewlett-_0d:8d:55 (00:25:b3:0d:8d:55)
Internet Protocol Version 4, Src: 10.0.1.13 (10.0.1.13), Dst: 10.0.1.14 (10.0.1.14)
Transmission Control Protocol, Src Port: 59519 (59519), Dst Port: ssh (22), Seq: 721, Ack: 961, Len: 0

No.     Time        Source                Destination           Protocol Length Info
     50 4.200021    10.0.1.13             10.0.1.14             SSH      114    Encrypted request packet len=48

Frame 50: 114 bytes on wire (912 bits), 114 bytes captured (912 bits)
Ethernet II, Src: Hewlett-_ca:2b:e8 (00:25:b3:ca:2b:e8), Dst: Hewlett-_0d:8d:55 (00:25:b3:0d:8d:55)
Internet Protocol Version 4, Src: 10.0.1.13 (10.0.1.13), Dst: 10.0.1.14 (10.0.1.14)
Transmission Control Protocol, Src Port: 59519 (59519), Dst Port: ssh (22), Seq: 721, Ack: 961, Len: 48
SSH Protocol

No.     Time        Source                Destination           Protocol Length Info
     51 4.200486    10.0.1.14             10.0.1.13             SSH      114    Encrypted response packet len=48

Frame 51: 114 bytes on wire (912 bits), 114 bytes captured (912 bits)
Ethernet II, Src: Hewlett-_0d:8d:55 (00:25:b3:0d:8d:55), Dst: Hewlett-_ca:2b:e8 (00:25:b3:ca:2b:e8)
Internet Protocol Version 4, Src: 10.0.1.14 (10.0.1.14), Dst: 10.0.1.13 (10.0.1.13)
Transmission Control Protocol, Src Port: ssh (22), Dst Port: 59519 (59519), Seq: 961, Ack: 769, Len: 48
SSH Protocol

No.     Time        Source                Destination           Protocol Length Info
     52 4.200737    10.0.1.13             10.0.1.14             TCP      66     59519 > ssh [ACK] Seq=769 Ack=1009 Win=185 Len=0 TSval=2390469 TSecr=2413722

Frame 52: 66 bytes on wire (528 bits), 66 bytes captured (528 bits)
Ethernet II, Src: Hewlett-_ca:2b:e8 (00:25:b3:ca:2b:e8), Dst: Hewlett-_0d:8d:55 (00:25:b3:0d:8d:55)
Internet Protocol Version 4, Src: 10.0.1.13 (10.0.1.13), Dst: 10.0.1.14 (10.0.1.14)
Transmission Control Protocol, Src Port: 59519 (59519), Dst Port: ssh (22), Seq: 769, Ack: 1009, Len: 0

No.     Time        Source                Destination           Protocol Length Info
     53 4.264022    10.0.1.13             10.0.1.14             SSH      114    Encrypted request packet len=48

Frame 53: 114 bytes on wire (912 bits), 114 bytes captured (912 bits)
Ethernet II, Src: Hewlett-_ca:2b:e8 (00:25:b3:ca:2b:e8), Dst: Hewlett-_0d:8d:55 (00:25:b3:0d:8d:55)
Internet Protocol Version 4, Src: 10.0.1.13 (10.0.1.13), Dst: 10.0.1.14 (10.0.1.14)
Transmission Control Protocol, Src Port: 59519 (59519), Dst Port: ssh (22), Seq: 769, Ack: 1009, Len: 48
SSH Protocol

No.     Time        Source                Destination           Protocol Length Info
     54 4.264415    10.0.1.14             10.0.1.13             SSH      114    Encrypted response packet len=48

Frame 54: 114 bytes on wire (912 bits), 114 bytes captured (912 bits)
Ethernet II, Src: Hewlett-_0d:8d:55 (00:25:b3:0d:8d:55), Dst: Hewlett-_ca:2b:e8 (00:25:b3:ca:2b:e8)
Internet Protocol Version 4, Src: 10.0.1.14 (10.0.1.14), Dst: 10.0.1.13 (10.0.1.13)
Transmission Control Protocol, Src Port: ssh (22), Dst Port: 59519 (59519), Seq: 1009, Ack: 817, Len: 48
SSH Protocol

No.     Time        Source                Destination           Protocol Length Info
     55 4.264687    10.0.1.13             10.0.1.14             TCP      66     59519 > ssh [ACK] Seq=817 Ack=1057 Win=185 Len=0 TSval=2390533 TSecr=2413786

Frame 55: 66 bytes on wire (528 bits), 66 bytes captured (528 bits)
Ethernet II, Src: Hewlett-_ca:2b:e8 (00:25:b3:ca:2b:e8), Dst: Hewlett-_0d:8d:55 (00:25:b3:0d:8d:55)
Internet Protocol Version 4, Src: 10.0.1.13 (10.0.1.13), Dst: 10.0.1.14 (10.0.1.14)
Transmission Control Protocol, Src Port: 59519 (59519), Dst Port: ssh (22), Seq: 817, Ack: 1057, Len: 0

No.     Time        Source                Destination           Protocol Length Info
     56 4.335959    10.0.1.13             10.0.1.14             SSH      114    Encrypted request packet len=48

Frame 56: 114 bytes on wire (912 bits), 114 bytes captured (912 bits)
Ethernet II, Src: Hewlett-_ca:2b:e8 (00:25:b3:ca:2b:e8), Dst: Hewlett-_0d:8d:55 (00:25:b3:0d:8d:55)
Internet Protocol Version 4, Src: 10.0.1.13 (10.0.1.13), Dst: 10.0.1.14 (10.0.1.14)
Transmission Control Protocol, Src Port: 59519 (59519), Dst Port: ssh (22), Seq: 817, Ack: 1057, Len: 48
SSH Protocol

No.     Time        Source                Destination           Protocol Length Info
     57 4.336416    10.0.1.14             10.0.1.13             SSH      114    Encrypted response packet len=48

Frame 57: 114 bytes on wire (912 bits), 114 bytes captured (912 bits)
Ethernet II, Src: Hewlett-_0d:8d:55 (00:25:b3:0d:8d:55), Dst: Hewlett-_ca:2b:e8 (00:25:b3:ca:2b:e8)
Internet Protocol Version 4, Src: 10.0.1.14 (10.0.1.14), Dst: 10.0.1.13 (10.0.1.13)
Transmission Control Protocol, Src Port: ssh (22), Dst Port: 59519 (59519), Seq: 1057, Ack: 865, Len: 48
SSH Protocol

No.     Time        Source                Destination           Protocol Length Info
     58 4.336689    10.0.1.13             10.0.1.14             TCP      66     59519 > ssh [ACK] Seq=865 Ack=1105 Win=185 Len=0 TSval=2390605 TSecr=2413858

Frame 58: 66 bytes on wire (528 bits), 66 bytes captured (528 bits)
Ethernet II, Src: Hewlett-_ca:2b:e8 (00:25:b3:ca:2b:e8), Dst: Hewlett-_0d:8d:55 (00:25:b3:0d:8d:55)
Internet Protocol Version 4, Src: 10.0.1.13 (10.0.1.13), Dst: 10.0.1.14 (10.0.1.14)
Transmission Control Protocol, Src Port: 59519 (59519), Dst Port: ssh (22), Seq: 865, Ack: 1105, Len: 0

No.     Time        Source                Destination           Protocol Length Info
     59 4.511987    10.0.1.13             10.0.1.14             SSH      114    Encrypted request packet len=48

Frame 59: 114 bytes on wire (912 bits), 114 bytes captured (912 bits)
Ethernet II, Src: Hewlett-_ca:2b:e8 (00:25:b3:ca:2b:e8), Dst: Hewlett-_0d:8d:55 (00:25:b3:0d:8d:55)
Internet Protocol Version 4, Src: 10.0.1.13 (10.0.1.13), Dst: 10.0.1.14 (10.0.1.14)
Transmission Control Protocol, Src Port: 59519 (59519), Dst Port: ssh (22), Seq: 865, Ack: 1105, Len: 48
SSH Protocol

No.     Time        Source                Destination           Protocol Length Info
     60 4.512387    10.0.1.14             10.0.1.13             SSH      114    Encrypted response packet len=48

Frame 60: 114 bytes on wire (912 bits), 114 bytes captured (912 bits)
Ethernet II, Src: Hewlett-_0d:8d:55 (00:25:b3:0d:8d:55), Dst: Hewlett-_ca:2b:e8 (00:25:b3:ca:2b:e8)
Internet Protocol Version 4, Src: 10.0.1.14 (10.0.1.14), Dst: 10.0.1.13 (10.0.1.13)
Transmission Control Protocol, Src Port: ssh (22), Dst Port: 59519 (59519), Seq: 1105, Ack: 913, Len: 48
SSH Protocol

No.     Time        Source                Destination           Protocol Length Info
     61 4.512658    10.0.1.13             10.0.1.14             TCP      66     59519 > ssh [ACK] Seq=913 Ack=1153 Win=185 Len=0 TSval=2390781 TSecr=2414034

Frame 61: 66 bytes on wire (528 bits), 66 bytes captured (528 bits)
Ethernet II, Src: Hewlett-_ca:2b:e8 (00:25:b3:ca:2b:e8), Dst: Hewlett-_0d:8d:55 (00:25:b3:0d:8d:55)
Internet Protocol Version 4, Src: 10.0.1.13 (10.0.1.13), Dst: 10.0.1.14 (10.0.1.14)
Transmission Control Protocol, Src Port: 59519 (59519), Dst Port: ssh (22), Seq: 913, Ack: 1153, Len: 0

No.     Time        Source                Destination           Protocol Length Info
     62 4.513175    10.0.1.14             10.0.1.13             SSH      178    Encrypted response packet len=112

Frame 62: 178 bytes on wire (1424 bits), 178 bytes captured (1424 bits)
Ethernet II, Src: Hewlett-_0d:8d:55 (00:25:b3:0d:8d:55), Dst: Hewlett-_ca:2b:e8 (00:25:b3:ca:2b:e8)
Internet Protocol Version 4, Src: 10.0.1.14 (10.0.1.14), Dst: 10.0.1.13 (10.0.1.13)
Transmission Control Protocol, Src Port: ssh (22), Dst Port: 59519 (59519), Seq: 1153, Ack: 913, Len: 112
SSH Protocol

No.     Time        Source                Destination           Protocol Length Info
     63 4.513444    10.0.1.13             10.0.1.14             TCP      66     59519 > ssh [ACK] Seq=913 Ack=1265 Win=185 Len=0 TSval=2390782 TSecr=2414035

Frame 63: 66 bytes on wire (528 bits), 66 bytes captured (528 bits)
Ethernet II, Src: Hewlett-_ca:2b:e8 (00:25:b3:ca:2b:e8), Dst: Hewlett-_0d:8d:55 (00:25:b3:0d:8d:55)
Internet Protocol Version 4, Src: 10.0.1.13 (10.0.1.13), Dst: 10.0.1.14 (10.0.1.14)
Transmission Control Protocol, Src Port: 59519 (59519), Dst Port: ssh (22), Seq: 913, Ack: 1265, Len: 0

No.     Time        Source                Destination           Protocol Length Info
     64 4.555608    10.0.1.14             10.0.1.13             SSH      130    Encrypted response packet len=64

Frame 64: 130 bytes on wire (1040 bits), 130 bytes captured (1040 bits)
Ethernet II, Src: Hewlett-_0d:8d:55 (00:25:b3:0d:8d:55), Dst: Hewlett-_ca:2b:e8 (00:25:b3:ca:2b:e8)
Internet Protocol Version 4, Src: 10.0.1.14 (10.0.1.14), Dst: 10.0.1.13 (10.0.1.13)
Transmission Control Protocol, Src Port: ssh (22), Dst Port: 59519 (59519), Seq: 1265, Ack: 913, Len: 64
SSH Protocol

No.     Time        Source                Destination           Protocol Length Info
     65 4.555932    10.0.1.13             10.0.1.14             TCP      66     59519 > ssh [ACK] Seq=913 Ack=1329 Win=185 Len=0 TSval=2390824 TSecr=2414077

Frame 65: 66 bytes on wire (528 bits), 66 bytes captured (528 bits)
Ethernet II, Src: Hewlett-_ca:2b:e8 (00:25:b3:ca:2b:e8), Dst: Hewlett-_0d:8d:55 (00:25:b3:0d:8d:55)
Internet Protocol Version 4, Src: 10.0.1.13 (10.0.1.13), Dst: 10.0.1.14 (10.0.1.14)
Transmission Control Protocol, Src Port: 59519 (59519), Dst Port: ssh (22), Seq: 913, Ack: 1329, Len: 0

No.     Time        Source                Destination           Protocol Length Info
     66 5.824199    10.0.1.13             10.0.1.14             SSH      114    Encrypted request packet len=48

Frame 66: 114 bytes on wire (912 bits), 114 bytes captured (912 bits)
Ethernet II, Src: Hewlett-_ca:2b:e8 (00:25:b3:ca:2b:e8), Dst: Hewlett-_0d:8d:55 (00:25:b3:0d:8d:55)
Internet Protocol Version 4, Src: 10.0.1.13 (10.0.1.13), Dst: 10.0.1.14 (10.0.1.14)
Transmission Control Protocol, Src Port: 59519 (59519), Dst Port: ssh (22), Seq: 913, Ack: 1329, Len: 48
SSH Protocol

No.     Time        Source                Destination           Protocol Length Info
     67 5.824447    10.0.1.14             10.0.1.13             SSH      114    Encrypted response packet len=48

Frame 67: 114 bytes on wire (912 bits), 114 bytes captured (912 bits)
Ethernet II, Src: Hewlett-_0d:8d:55 (00:25:b3:0d:8d:55), Dst: Hewlett-_ca:2b:e8 (00:25:b3:ca:2b:e8)
Internet Protocol Version 4, Src: 10.0.1.14 (10.0.1.14), Dst: 10.0.1.13 (10.0.1.13)
Transmission Control Protocol, Src Port: ssh (22), Dst Port: 59519 (59519), Seq: 1329, Ack: 961, Len: 48
SSH Protocol

No.     Time        Source                Destination           Protocol Length Info
     68 5.824450    10.0.1.13             10.0.1.14             TCP      66     59519 > ssh [ACK] Seq=961 Ack=1377 Win=185 Len=0 TSval=2392093 TSecr=2415346

Frame 68: 66 bytes on wire (528 bits), 66 bytes captured (528 bits)
Ethernet II, Src: Hewlett-_ca:2b:e8 (00:25:b3:ca:2b:e8), Dst: Hewlett-_0d:8d:55 (00:25:b3:0d:8d:55)
Internet Protocol Version 4, Src: 10.0.1.13 (10.0.1.13), Dst: 10.0.1.14 (10.0.1.14)
Transmission Control Protocol, Src Port: 59519 (59519), Dst Port: ssh (22), Seq: 961, Ack: 1377, Len: 0

No.     Time        Source                Destination           Protocol Length Info
     69 5.904052    10.0.1.13             10.0.1.14             SSH      114    Encrypted request packet len=48

Frame 69: 114 bytes on wire (912 bits), 114 bytes captured (912 bits)
Ethernet II, Src: Hewlett-_ca:2b:e8 (00:25:b3:ca:2b:e8), Dst: Hewlett-_0d:8d:55 (00:25:b3:0d:8d:55)
Internet Protocol Version 4, Src: 10.0.1.13 (10.0.1.13), Dst: 10.0.1.14 (10.0.1.14)
Transmission Control Protocol, Src Port: 59519 (59519), Dst Port: ssh (22), Seq: 961, Ack: 1377, Len: 48
SSH Protocol

No.     Time        Source                Destination           Protocol Length Info
     70 5.904427    10.0.1.14             10.0.1.13             SSH      114    Encrypted response packet len=48

Frame 70: 114 bytes on wire (912 bits), 114 bytes captured (912 bits)
