No.     Time        Source                Destination           Protocol Length Info
      1 0.000000    Hewlett-_11:30:e9     Broadcast             ARP      42     Who has 10.0.1.12?  Tell 10.0.1.11

Frame 1: 42 bytes on wire (336 bits), 42 bytes captured (336 bits)
Ethernet II, Src: Hewlett-_11:30:e9 (00:24:81:11:30:e9), Dst: Broadcast (ff:ff:ff:ff:ff:ff)
Address Resolution Protocol (request)

No.     Time        Source                Destination           Protocol Length Info
      2 0.000536    Hewlett-_c4:b4:32     Hewlett-_11:30:e9     ARP      60     10.0.1.12 is at 00:24:81:c4:b4:32

Frame 2: 60 bytes on wire (480 bits), 60 bytes captured (480 bits)
Ethernet II, Src: Hewlett-_c4:b4:32 (00:24:81:c4:b4:32), Dst: Hewlett-_11:30:e9 (00:24:81:11:30:e9)
Address Resolution Protocol (reply)

No.     Time        Source                Destination           Protocol Length Info
      3 0.000543    10.0.1.11             10.0.1.12             ICMP     98     Echo (ping) request  id=0x0728, seq=1/256, ttl=64

Frame 3: 98 bytes on wire (784 bits), 98 bytes captured (784 bits)
Ethernet II, Src: Hewlett-_11:30:e9 (00:24:81:11:30:e9), Dst: Hewlett-_c4:b4:32 (00:24:81:c4:b4:32)
Internet Protocol Version 4, Src: 10.0.1.11 (10.0.1.11), Dst: 10.0.1.12 (10.0.1.12)
Internet Control Message Protocol

No.     Time        Source                Destination           Protocol Length Info
      4 0.001093    10.0.1.12             10.0.1.11             ICMP     98     Echo (ping) reply    id=0x0728, seq=1/256, ttl=64

Frame 4: 98 bytes on wire (784 bits), 98 bytes captured (784 bits)
Ethernet II, Src: Hewlett-_c4:b4:32 (00:24:81:c4:b4:32), Dst: Hewlett-_11:30:e9 (00:24:81:11:30:e9)
Internet Protocol Version 4, Src: 10.0.1.12 (10.0.1.12), Dst: 10.0.1.11 (10.0.1.11)
Internet Control Message Protocol

No.     Time        Source                Destination           Protocol Length Info
      5 1.001172    10.0.1.11             10.0.1.12             ICMP     98     Echo (ping) request  id=0x0728, seq=2/512, ttl=64

Frame 5: 98 bytes on wire (784 bits), 98 bytes captured (784 bits)
Ethernet II, Src: Hewlett-_11:30:e9 (00:24:81:11:30:e9), Dst: Hewlett-_c4:b4:32 (00:24:81:c4:b4:32)
Internet Protocol Version 4, Src: 10.0.1.11 (10.0.1.11), Dst: 10.0.1.12 (10.0.1.12)
Internet Control Message Protocol

No.     Time        Source                Destination           Protocol Length Info
      6 1.001724    10.0.1.12             10.0.1.11             ICMP     98     Echo (ping) reply    id=0x0728, seq=2/512, ttl=64

Frame 6: 98 bytes on wire (784 bits), 98 bytes captured (784 bits)
Ethernet II, Src: Hewlett-_c4:b4:32 (00:24:81:c4:b4:32), Dst: Hewlett-_11:30:e9 (00:24:81:11:30:e9)
Internet Protocol Version 4, Src: 10.0.1.12 (10.0.1.12), Dst: 10.0.1.11 (10.0.1.11)
Internet Control Message Protocol

No.     Time        Source                Destination           Protocol Length Info
      7 2.001641    10.0.1.11             10.0.1.12             ICMP     98     Echo (ping) request  id=0x0728, seq=3/768, ttl=64

Frame 7: 98 bytes on wire (784 bits), 98 bytes captured (784 bits)
Ethernet II, Src: Hewlett-_11:30:e9 (00:24:81:11:30:e9), Dst: Hewlett-_c4:b4:32 (00:24:81:c4:b4:32)
Internet Protocol Version 4, Src: 10.0.1.11 (10.0.1.11), Dst: 10.0.1.12 (10.0.1.12)
Internet Control Message Protocol

No.     Time        Source                Destination           Protocol Length Info
      8 2.002157    10.0.1.12             10.0.1.11             ICMP     98     Echo (ping) reply    id=0x0728, seq=3/768, ttl=64

Frame 8: 98 bytes on wire (784 bits), 98 bytes captured (784 bits)
Ethernet II, Src: Hewlett-_c4:b4:32 (00:24:81:c4:b4:32), Dst: Hewlett-_11:30:e9 (00:24:81:11:30:e9)
Internet Protocol Version 4, Src: 10.0.1.12 (10.0.1.12), Dst: 10.0.1.11 (10.0.1.11)
Internet Control Message Protocol

No.     Time        Source                Destination           Protocol Length Info
      9 3.001636    10.0.1.11             10.0.1.12             ICMP     98     Echo (ping) request  id=0x0728, seq=4/1024, ttl=64

Frame 9: 98 bytes on wire (784 bits), 98 bytes captured (784 bits)
Ethernet II, Src: Hewlett-_11:30:e9 (00:24:81:11:30:e9), Dst: Hewlett-_c4:b4:32 (00:24:81:c4:b4:32)
Internet Protocol Version 4, Src: 10.0.1.11 (10.0.1.11), Dst: 10.0.1.12 (10.0.1.12)
Internet Control Message Protocol

No.     Time        Source                Destination           Protocol Length Info
     10 3.002132    10.0.1.12             10.0.1.11             ICMP     98     Echo (ping) reply    id=0x0728, seq=4/1024, ttl=64

Frame 10: 98 bytes on wire (784 bits), 98 bytes captured (784 bits)
Ethernet II, Src: Hewlett-_c4:b4:32 (00:24:81:c4:b4:32), Dst: Hewlett-_11:30:e9 (00:24:81:11:30:e9)
Internet Protocol Version 4, Src: 10.0.1.12 (10.0.1.12), Dst: 10.0.1.11 (10.0.1.11)
Internet Control Message Protocol

No.     Time        Source                Destination           Protocol Length Info
     11 5.012118    Hewlett-_c4:b4:32     Hewlett-_11:30:e9     ARP      60     Who has 10.0.1.11?  Tell 10.0.1.12

Frame 11: 60 bytes on wire (480 bits), 60 bytes captured (480 bits)
Ethernet II, Src: Hewlett-_c4:b4:32 (00:24:81:c4:b4:32), Dst: Hewlett-_11:30:e9 (00:24:81:11:30:e9)
Address Resolution Protocol (request)

No.     Time        Source                Destination           Protocol Length Info
     12 5.012130    Hewlett-_11:30:e9     Hewlett-_c4:b4:32     ARP      42     10.0.1.11 is at 00:24:81:11:30:e9

Frame 12: 42 bytes on wire (336 bits), 42 bytes captured (336 bits)
Ethernet II, Src: Hewlett-_11:30:e9 (00:24:81:11:30:e9), Dst: Hewlett-_c4:b4:32 (00:24:81:c4:b4:32)
Address Resolution Protocol (reply)

No.     Time        Source                Destination           Protocol Length Info
     13 76.910657   Hewlett-_0d:8d:55     Broadcast             ARP      60     Who has 10.0.1.12?  Tell 10.0.1.14

Frame 13: 60 bytes on wire (480 bits), 60 bytes captured (480 bits)
Ethernet II, Src: Hewlett-_0d:8d:55 (00:25:b3:0d:8d:55), Dst: Broadcast (ff:ff:ff:ff:ff:ff)
Address Resolution Protocol (request)

No.     Time        Source                Destination           Protocol Length Info
     14 76.910947   Hewlett-_c4:b4:32     Hewlett-_0d:8d:55     ARP      60     10.0.1.12 is at 00:24:81:c4:b4:32

Frame 14: 60 bytes on wire (480 bits), 60 bytes captured (480 bits)
Ethernet II, Src: Hewlett-_c4:b4:32 (00:24:81:c4:b4:32), Dst: Hewlett-_0d:8d:55 (00:25:b3:0d:8d:55)
Address Resolution Protocol (reply)

No.     Time        Source                Destination           Protocol Length Info
     15 76.911220   10.0.1.14             10.0.1.12             TCP      74     42548 > ssh [SYN] Seq=0 Win=14600 Len=0 MSS=1460 SACK_PERM=1 TSval=1390412 TSecr=0 WS=128

Frame 15: 74 bytes on wire (592 bits), 74 bytes captured (592 bits)
Ethernet II, Src: Hewlett-_0d:8d:55 (00:25:b3:0d:8d:55), Dst: Hewlett-_c4:b4:32 (00:24:81:c4:b4:32)
Internet Protocol Version 4, Src: 10.0.1.14 (10.0.1.14), Dst: 10.0.1.12 (10.0.1.12)
Transmission Control Protocol, Src Port: 42548 (42548), Dst Port: ssh (22), Seq: 0, Len: 0

No.     Time        Source                Destination           Protocol Length Info
     16 76.911503   10.0.1.12             10.0.1.14             TCP      74     ssh > 42548 [SYN, ACK] Seq=0 Ack=1 Win=14480 Len=0 MSS=1460 SACK_PERM=1 TSval=1334667 TSecr=1390412 WS=128

Frame 16: 74 bytes on wire (592 bits), 74 bytes captured (592 bits)
Ethernet II, Src: Hewlett-_c4:b4:32 (00:24:81:c4:b4:32), Dst: Hewlett-_0d:8d:55 (00:25:b3:0d:8d:55)
Internet Protocol Version 4, Src: 10.0.1.12 (10.0.1.12), Dst: 10.0.1.14 (10.0.1.14)
Transmission Control Protocol, Src Port: ssh (22), Dst Port: 42548 (42548), Seq: 0, Ack: 1, Len: 0

No.     Time        Source                Destination           Protocol Length Info
     17 76.911793   10.0.1.14             10.0.1.12             TCP      66     42548 > ssh [ACK] Seq=1 Ack=1 Win=14720 Len=0 TSval=1390413 TSecr=1334667

Frame 17: 66 bytes on wire (528 bits), 66 bytes captured (528 bits)
Ethernet II, Src: Hewlett-_0d:8d:55 (00:25:b3:0d:8d:55), Dst: Hewlett-_c4:b4:32 (00:24:81:c4:b4:32)
Internet Protocol Version 4, Src: 10.0.1.14 (10.0.1.14), Dst: 10.0.1.12 (10.0.1.12)
Transmission Control Protocol, Src Port: 42548 (42548), Dst Port: ssh (22), Seq: 1, Ack: 1, Len: 0

No.     Time        Source                Destination           Protocol Length Info
     18 76.932333   10.0.1.12             10.0.1.14             SSHv2    87     Server Protocol: SSH-2.0-OpenSSH_5.9\r

Frame 18: 87 bytes on wire (696 bits), 87 bytes captured (696 bits)
Ethernet II, Src: Hewlett-_c4:b4:32 (00:24:81:c4:b4:32), Dst: Hewlett-_0d:8d:55 (00:25:b3:0d:8d:55)
Internet Protocol Version 4, Src: 10.0.1.12 (10.0.1.12), Dst: 10.0.1.14 (10.0.1.14)
Transmission Control Protocol, Src Port: ssh (22), Dst Port: 42548 (42548), Seq: 1, Ack: 1, Len: 21
SSH Protocol

No.     Time        Source                Destination           Protocol Length Info
     19 76.932583   10.0.1.14             10.0.1.12             TCP      66     42548 > ssh [ACK] Seq=1 Ack=22 Win=14720 Len=0 TSval=1390434 TSecr=1334688

Frame 19: 66 bytes on wire (528 bits), 66 bytes captured (528 bits)
Ethernet II, Src: Hewlett-_0d:8d:55 (00:25:b3:0d:8d:55), Dst: Hewlett-_c4:b4:32 (00:24:81:c4:b4:32)
Internet Protocol Version 4, Src: 10.0.1.14 (10.0.1.14), Dst: 10.0.1.12 (10.0.1.12)
Transmission Control Protocol, Src Port: 42548 (42548), Dst Port: ssh (22), Seq: 1, Ack: 22, Len: 0

No.     Time        Source                Destination           Protocol Length Info
     20 76.932586   10.0.1.14             10.0.1.12             SSHv2    87     Client Protocol: SSH-2.0-OpenSSH_5.9\r

Frame 20: 87 bytes on wire (696 bits), 87 bytes captured (696 bits)
Ethernet II, Src: Hewlett-_0d:8d:55 (00:25:b3:0d:8d:55), Dst: Hewlett-_c4:b4:32 (00:24:81:c4:b4:32)
Internet Protocol Version 4, Src: 10.0.1.14 (10.0.1.14), Dst: 10.0.1.12 (10.0.1.12)
Transmission Control Protocol, Src Port: 42548 (42548), Dst Port: ssh (22), Seq: 1, Ack: 22, Len: 21
SSH Protocol

No.     Time        Source                Destination           Protocol Length Info
     21 76.932851   10.0.1.12             10.0.1.14             TCP      66     ssh > 42548 [ACK] Seq=22 Ack=22 Win=14592 Len=0 TSval=1334688 TSecr=1390434

Frame 21: 66 bytes on wire (528 bits), 66 bytes captured (528 bits)
Ethernet II, Src: Hewlett-_c4:b4:32 (00:24:81:c4:b4:32), Dst: Hewlett-_0d:8d:55 (00:25:b3:0d:8d:55)
Internet Protocol Version 4, Src: 10.0.1.12 (10.0.1.12), Dst: 10.0.1.14 (10.0.1.14)
Transmission Control Protocol, Src Port: ssh (22), Dst Port: 42548 (42548), Seq: 22, Ack: 22, Len: 0

No.     Time        Source                Destination           Protocol Length Info
     22 76.933876   10.0.1.14             10.0.1.12             SSHv2    1098   Client: Key Exchange Init

Frame 22: 1098 bytes on wire (8784 bits), 1098 bytes captured (8784 bits)
Ethernet II, Src: Hewlett-_0d:8d:55 (00:25:b3:0d:8d:55), Dst: Hewlett-_c4:b4:32 (00:24:81:c4:b4:32)
Internet Protocol Version 4, Src: 10.0.1.14 (10.0.1.14), Dst: 10.0.1.12 (10.0.1.12)
Transmission Control Protocol, Src Port: 42548 (42548), Dst Port: ssh (22), Seq: 22, Ack: 22, Len: 1032
SSH Protocol

No.     Time        Source                Destination           Protocol Length Info
     23 76.934627   10.0.1.12             10.0.1.14             SSHv2    970    Server: Key Exchange Init

Frame 23: 970 bytes on wire (7760 bits), 970 bytes captured (7760 bits)
Ethernet II, Src: Hewlett-_c4:b4:32 (00:24:81:c4:b4:32), Dst: Hewlett-_0d:8d:55 (00:25:b3:0d:8d:55)
Internet Protocol Version 4, Src: 10.0.1.12 (10.0.1.12), Dst: 10.0.1.14 (10.0.1.14)
Transmission Control Protocol, Src Port: ssh (22), Dst Port: 42548 (42548), Seq: 22, Ack: 22, Len: 904
SSH Protocol

No.     Time        Source                Destination           Protocol Length Info
     24 76.974109   10.0.1.12             10.0.1.14             TCP      66     ssh > 42548 [ACK] Seq=926 Ack=1054 Win=16640 Len=0 TSval=1334730 TSecr=1390434

Frame 24: 66 bytes on wire (528 bits), 66 bytes captured (528 bits)
Ethernet II, Src: Hewlett-_c4:b4:32 (00:24:81:c4:b4:32), Dst: Hewlett-_0d:8d:55 (00:25:b3:0d:8d:55)
Internet Protocol Version 4, Src: 10.0.1.12 (10.0.1.12), Dst: 10.0.1.14 (10.0.1.14)
Transmission Control Protocol, Src Port: ssh (22), Dst Port: 42548 (42548), Seq: 926, Ack: 1054, Len: 0

No.     Time        Source                Destination           Protocol Length Info
     25 76.974113   10.0.1.14             10.0.1.12             TCP      66     42548 > ssh [ACK] Seq=1054 Ack=926 Win=16512 Len=0 TSval=1390476 TSecr=1334689

Frame 25: 66 bytes on wire (528 bits), 66 bytes captured (528 bits)
Ethernet II, Src: Hewlett-_0d:8d:55 (00:25:b3:0d:8d:55), Dst: Hewlett-_c4:b4:32 (00:24:81:c4:b4:32)
Internet Protocol Version 4, Src: 10.0.1.14 (10.0.1.14), Dst: 10.0.1.12 (10.0.1.12)
Transmission Control Protocol, Src Port: 42548 (42548), Dst Port: ssh (22), Seq: 1054, Ack: 926, Len: 0

No.     Time        Source                Destination           Protocol Length Info
     26 76.974377   10.0.1.14             10.0.1.12             SSHv2    90     Client: Diffie-Hellman GEX Request

Frame 26: 90 bytes on wire (720 bits), 90 bytes captured (720 bits)
Ethernet II, Src: Hewlett-_0d:8d:55 (00:25:b3:0d:8d:55), Dst: Hewlett-_c4:b4:32 (00:24:81:c4:b4:32)
Internet Protocol Version 4, Src: 10.0.1.14 (10.0.1.14), Dst: 10.0.1.12 (10.0.1.12)
Transmission Control Protocol, Src Port: 42548 (42548), Dst Port: ssh (22), Seq: 1054, Ack: 926, Len: 24
SSH Protocol

No.     Time        Source                Destination           Protocol Length Info
     27 76.974647   10.0.1.12             10.0.1.14             TCP      66     ssh > 42548 [ACK] Seq=926 Ack=1078 Win=16640 Len=0 TSval=1334730 TSecr=1390476

Frame 27: 66 bytes on wire (528 bits), 66 bytes captured (528 bits)
Ethernet II, Src: Hewlett-_c4:b4:32 (00:24:81:c4:b4:32), Dst: Hewlett-_0d:8d:55 (00:25:b3:0d:8d:55)
Internet Protocol Version 4, Src: 10.0.1.12 (10.0.1.12), Dst: 10.0.1.14 (10.0.1.14)
Transmission Control Protocol, Src Port: ssh (22), Dst Port: 42548 (42548), Seq: 926, Ack: 1078, Len: 0

No.     Time        Source                Destination           Protocol Length Info
     28 76.983719   10.0.1.12             10.0.1.14             SSHv2    218    Server: Diffie-Hellman Key Exchange Reply

Frame 28: 218 bytes on wire (1744 bits), 218 bytes captured (1744 bits)
Ethernet II, Src: Hewlett-_c4:b4:32 (00:24:81:c4:b4:32), Dst: Hewlett-_0d:8d:55 (00:25:b3:0d:8d:55)
Internet Protocol Version 4, Src: 10.0.1.12 (10.0.1.12), Dst: 10.0.1.14 (10.0.1.14)
Transmission Control Protocol, Src Port: ssh (22), Dst Port: 42548 (42548), Seq: 926, Ack: 1078, Len: 152
SSH Protocol

No.     Time        Source                Destination           Protocol Length Info
     29 76.983722   10.0.1.14             10.0.1.12             TCP      66     42548 > ssh [ACK] Seq=1078 Ack=1078 Win=18304 Len=0 TSval=1390485 TSecr=1334739

Frame 29: 66 bytes on wire (528 bits), 66 bytes captured (528 bits)
Ethernet II, Src: Hewlett-_0d:8d:55 (00:25:b3:0d:8d:55), Dst: Hewlett-_c4:b4:32 (00:24:81:c4:b4:32)
Internet Protocol Version 4, Src: 10.0.1.14 (10.0.1.14), Dst: 10.0.1.12 (10.0.1.12)
Transmission Control Protocol, Src Port: 42548 (42548), Dst Port: ssh (22), Seq: 1078, Ack: 1078, Len: 0

No.     Time        Source                Destination           Protocol Length Info
     30 76.984506   10.0.1.14             10.0.1.12             SSHv2    210    Client: Diffie-Hellman GEX Init

Frame 30: 210 bytes on wire (1680 bits), 210 bytes captured (1680 bits)
Ethernet II, Src: Hewlett-_0d:8d:55 (00:25:b3:0d:8d:55), Dst: Hewlett-_c4:b4:32 (00:24:81:c4:b4:32)
Internet Protocol Version 4, Src: 10.0.1.14 (10.0.1.14), Dst: 10.0.1.12 (10.0.1.12)
Transmission Control Protocol, Src Port: 42548 (42548), Dst Port: ssh (22), Seq: 1078, Ack: 1078, Len: 144
SSH Protocol

No.     Time        Source                Destination           Protocol Length Info
     31 76.990964   10.0.1.12             10.0.1.14             SSHv2    786    Server: Diffie-Hellman GEX Reply

Frame 31: 786 bytes on wire (6288 bits), 786 bytes captured (6288 bits)
Ethernet II, Src: Hewlett-_c4:b4:32 (00:24:81:c4:b4:32), Dst: Hewlett-_0d:8d:55 (00:25:b3:0d:8d:55)
Internet Protocol Version 4, Src: 10.0.1.12 (10.0.1.12), Dst: 10.0.1.14 (10.0.1.14)
Transmission Control Protocol, Src Port: ssh (22), Dst Port: 42548 (42548), Seq: 1078, Ack: 1222, Len: 720
SSH Protocol

No.     Time        Source                Destination           Protocol Length Info
     32 76.992220   10.0.1.14             10.0.1.12             SSHv2    82     Client: New Keys

Frame 32: 82 bytes on wire (656 bits), 82 bytes captured (656 bits)
Ethernet II, Src: Hewlett-_0d:8d:55 (00:25:b3:0d:8d:55), Dst: Hewlett-_c4:b4:32 (00:24:81:c4:b4:32)
Internet Protocol Version 4, Src: 10.0.1.14 (10.0.1.14), Dst: 10.0.1.12 (10.0.1.12)
Transmission Control Protocol, Src Port: 42548 (42548), Dst Port: ssh (22), Seq: 1222, Ack: 1798, Len: 16
SSH Protocol

No.     Time        Source                Destination           Protocol Length Info
     33 77.032108   10.0.1.12             10.0.1.14             TCP      66     ssh > 42548 [ACK] Seq=1798 Ack=1238 Win=18688 Len=0 TSval=1334788 TSecr=1390493

Frame 33: 66 bytes on wire (528 bits), 66 bytes captured (528 bits)
Ethernet II, Src: Hewlett-_c4:b4:32 (00:24:81:c4:b4:32), Dst: Hewlett-_0d:8d:55 (00:25:b3:0d:8d:55)
Internet Protocol Version 4, Src: 10.0.1.12 (10.0.1.12), Dst: 10.0.1.14 (10.0.1.14)
Transmission Control Protocol, Src Port: ssh (22), Dst Port: 42548 (42548), Seq: 1798, Ack: 1238, Len: 0

No.     Time        Source                Destination           Protocol Length Info
     34 77.032357   10.0.1.14             10.0.1.12             SSHv2    114    Encrypted request packet len=48

Frame 34: 114 bytes on wire (912 bits), 114 bytes captured (912 bits)
Ethernet II, Src: Hewlett-_0d:8d:55 (00:25:b3:0d:8d:55), Dst: Hewlett-_c4:b4:32 (00:24:81:c4:b4:32)
Internet Protocol Version 4, Src: 10.0.1.14 (10.0.1.14), Dst: 10.0.1.12 (10.0.1.12)
Transmission Control Protocol, Src Port: 42548 (42548), Dst Port: ssh (22), Seq: 1238, Ack: 1798, Len: 48
SSH Protocol

No.     Time        Source                Destination           Protocol Length Info
     35 77.032609   10.0.1.12             10.0.1.14             TCP      66     ssh > 42548 [ACK] Seq=1798 Ack=1286 Win=18688 Len=0 TSval=1334788 TSecr=1390534

Frame 35: 66 bytes on wire (528 bits), 66 bytes captured (528 bits)
Ethernet II, Src: Hewlett-_c4:b4:32 (00:24:81:c4:b4:32), Dst: Hewlett-_0d:8d:55 (00:25:b3:0d:8d:55)
Internet Protocol Version 4, Src: 10.0.1.12 (10.0.1.12), Dst: 10.0.1.14 (10.0.1.14)
Transmission Control Protocol, Src Port: ssh (22), Dst Port: 42548 (42548), Seq: 1798, Ack: 1286, Len: 0

No.     Time        Source                Destination           Protocol Length Info
     36 77.032612   10.0.1.12             10.0.1.14             SSHv2    114    Encrypted response packet len=48

Frame 36: 114 bytes on wire (912 bits), 114 bytes captured (912 bits)
Ethernet II, Src: Hewlett-_c4:b4:32 (00:24:81:c4:b4:32), Dst: Hewlett-_0d:8d:55 (00:25:b3:0d:8d:55)
Internet Protocol Version 4, Src: 10.0.1.12 (10.0.1.12), Dst: 10.0.1.14 (10.0.1.14)
Transmission Control Protocol, Src Port: ssh (22), Dst Port: 42548 (42548), Seq: 1798, Ack: 1286, Len: 48
SSH Protocol

No.     Time        Source                Destination           Protocol Length Info
     37 77.033698   10.0.1.14             10.0.1.12             SSHv2    130    Encrypted request packet len=64

Frame 37: 130 bytes on wire (1040 bits), 130 bytes captured (1040 bits)
Ethernet II, Src: Hewlett-_0d:8d:55 (00:25:b3:0d:8d:55), Dst: Hewlett-_c4:b4:32 (00:24:81:c4:b4:32)
Internet Protocol Version 4, Src: 10.0.1.14 (10.0.1.14), Dst: 10.0.1.12 (10.0.1.12)
Transmission Control Protocol, Src Port: 42548 (42548), Dst Port: ssh (22), Seq: 1286, Ack: 1846, Len: 64
SSH Protocol

No.     Time        Source                Destination           Protocol Length Info
     38 77.034617   10.0.1.12             10.0.1.14             SSHv2    146    Encrypted response packet len=80

Frame 38: 146 bytes on wire (1168 bits), 146 bytes captured (1168 bits)
Ethernet II, Src: Hewlett-_c4:b4:32 (00:24:81:c4:b4:32), Dst: Hewlett-_0d:8d:55 (00:25:b3:0d:8d:55)
Internet Protocol Version 4, Src: 10.0.1.12 (10.0.1.12), Dst: 10.0.1.14 (10.0.1.14)
Transmission Control Protocol, Src Port: ssh (22), Dst Port: 42548 (42548), Seq: 1846, Ack: 1350, Len: 80
SSH Protocol

No.     Time        Source                Destination           Protocol Length Info
     39 77.074245   10.0.1.14             10.0.1.12             TCP      66     42548 > ssh [ACK] Seq=1350 Ack=1926 Win=20096 Len=0 TSval=1390576 TSecr=1334790

Frame 39: 66 bytes on wire (528 bits), 66 bytes captured (528 bits)
Ethernet II, Src: Hewlett-_0d:8d:55 (00:25:b3:0d:8d:55), Dst: Hewlett-_c4:b4:32 (00:24:81:c4:b4:32)
Internet Protocol Version 4, Src: 10.0.1.14 (10.0.1.14), Dst: 10.0.1.12 (10.0.1.12)
Transmission Control Protocol, Src Port: 42548 (42548), Dst Port: ssh (22), Seq: 1350, Ack: 1926, Len: 0

No.     Time        Source                Destination           Protocol Length Info
     40 78.304789   10.0.1.14             10.0.1.12             SSHv2    210    Encrypted request packet len=144

Frame 40: 210 bytes on wire (1680 bits), 210 bytes captured (1680 bits)
Ethernet II, Src: Hewlett-_0d:8d:55 (00:25:b3:0d:8d:55), Dst: Hewlett-_c4:b4:32 (00:24:81:c4:b4:32)
Internet Protocol Version 4, Src: 10.0.1.14 (10.0.1.14), Dst: 10.0.1.12 (10.0.1.12)
Transmission Control Protocol, Src Port: 42548 (42548), Dst Port: ssh (22), Seq: 1350, Ack: 1926, Len: 144
SSH Protocol

No.     Time        Source                Destination           Protocol Length Info
     41 78.315595   10.0.1.12             10.0.1.14             SSHv2    98     Encrypted response packet len=32

Frame 41: 98 bytes on wire (784 bits), 98 bytes captured (784 bits)
Ethernet II, Src: Hewlett-_c4:b4:32 (00:24:81:c4:b4:32), Dst: Hewlett-_0d:8d:55 (00:25:b3:0d:8d:55)
Internet Protocol Version 4, Src: 10.0.1.12 (10.0.1.12), Dst: 10.0.1.14 (10.0.1.14)
Transmission Control Protocol, Src Port: ssh (22), Dst Port: 42548 (42548), Seq: 1926, Ack: 1494, Len: 32
SSH Protocol

No.     Time        Source                Destination           Protocol Length Info
     42 78.315875   10.0.1.14             10.0.1.12             TCP      66     42548 > ssh [ACK] Seq=1494 Ack=1958 Win=20096 Len=0 TSval=1391817 TSecr=1336071

Frame 42: 66 bytes on wire (528 bits), 66 bytes captured (528 bits)
Ethernet II, Src: Hewlett-_0d:8d:55 (00:25:b3:0d:8d:55), Dst: Hewlett-_c4:b4:32 (00:24:81:c4:b4:32)
Internet Protocol Version 4, Src: 10.0.1.14 (10.0.1.14), Dst: 10.0.1.12 (10.0.1.12)
Transmission Control Protocol, Src Port: 42548 (42548), Dst Port: ssh (22), Seq: 1494, Ack: 1958, Len: 0

No.     Time        Source                Destination           Protocol Length Info
     43 78.316126   10.0.1.14             10.0.1.12             SSHv2    194    Encrypted request packet len=128

Frame 43: 194 bytes on wire (1552 bits), 194 bytes captured (1552 bits)
Ethernet II, Src: Hewlett-_0d:8d:55 (00:25:b3:0d:8d:55), Dst: Hewlett-_c4:b4:32 (00:24:81:c4:b4:32)
Internet Protocol Version 4, Src: 10.0.1.14 (10.0.1.14), Dst: 10.0.1.12 (10.0.1.12)
Transmission Control Protocol, Src Port: 42548 (42548), Dst Port: ssh (22), Seq: 1494, Ack: 1958, Len: 128
SSH Protocol

No.     Time        Source                Destination           Protocol Length Info
     44 78.356114   10.0.1.12             10.0.1.14             TCP      66     ssh > 42548 [ACK] Seq=1958 Ack=1622 Win=22784 Len=0 TSval=1336112 TSecr=1391817

Frame 44: 66 bytes on wire (528 bits), 66 bytes captured (528 bits)
Ethernet II, Src: Hewlett-_c4:b4:32 (00:24:81:c4:b4:32), Dst: Hewlett-_0d:8d:55 (00:25:b3:0d:8d:55)
Internet Protocol Version 4, Src: 10.0.1.12 (10.0.1.12), Dst: 10.0.1.14 (10.0.1.14)
Transmission Control Protocol, Src Port: ssh (22), Dst Port: 42548 (42548), Seq: 1958, Ack: 1622, Len: 0

No.     Time        Source                Destination           Protocol Length Info
     45 78.375804   10.0.1.12             10.0.1.14             SSHv2    114    Encrypted response packet len=48

Frame 45: 114 bytes on wire (912 bits), 114 bytes captured (912 bits)
Ethernet II, Src: Hewlett-_c4:b4:32 (00:24:81:c4:b4:32), Dst: Hewlett-_0d:8d:55 (00:25:b3:0d:8d:55)
Internet Protocol Version 4, Src: 10.0.1.12 (10.0.1.12), Dst: 10.0.1.14 (10.0.1.14)
Transmission Control Protocol, Src Port: ssh (22), Dst Port: 42548 (42548), Seq: 1958, Ack: 1622, Len: 48
SSH Protocol

No.     Time        Source                Destination           Protocol Length Info
     46 78.376683   10.0.1.14             10.0.1.12             SSHv2    578    Encrypted request packet len=512

Frame 46: 578 bytes on wire (4624 bits), 578 bytes captured (4624 bits)
Ethernet II, Src: Hewlett-_0d:8d:55 (00:25:b3:0d:8d:55), Dst: Hewlett-_c4:b4:32 (00:24:81:c4:b4:32)
Internet Protocol Version 4, Src: 10.0.1.14 (10.0.1.14), Dst: 10.0.1.12 (10.0.1.12)
Transmission Control Protocol, Src Port: 42548 (42548), Dst Port: ssh (22), Seq: 1622, Ack: 2006, Len: 512
SSH Protocol

No.     Time        Source                Destination           Protocol Length Info
     47 78.376687   10.0.1.12             10.0.1.14             TCP      66     ssh > 42548 [ACK] Seq=2006 Ack=2134 Win=24832 Len=0 TSval=1336132 TSecr=1391877

Frame 47: 66 bytes on wire (528 bits), 66 bytes captured (528 bits)
Ethernet II, Src: Hewlett-_c4:b4:32 (00:24:81:c4:b4:32), Dst: Hewlett-_0d:8d:55 (00:25:b3:0d:8d:55)
Internet Protocol Version 4, Src: 10.0.1.12 (10.0.1.12), Dst: 10.0.1.14 (10.0.1.14)
Transmission Control Protocol, Src Port: ssh (22), Dst Port: 42548 (42548), Seq: 2006, Ack: 2134, Len: 0

No.     Time        Source                Destination           Protocol Length Info
     48 78.428710   10.0.1.12             10.0.1.14             SSHv2    178    Encrypted response packet len=112

Frame 48: 178 bytes on wire (1424 bits), 178 bytes captured (1424 bits)
Ethernet II, Src: Hewlett-_c4:b4:32 (00:24:81:c4:b4:32), Dst: Hewlett-_0d:8d:55 (00:25:b3:0d:8d:55)
Internet Protocol Version 4, Src: 10.0.1.12 (10.0.1.12), Dst: 10.0.1.14 (10.0.1.14)
Transmission Control Protocol, Src Port: ssh (22), Dst Port: 42548 (42548), Seq: 2006, Ack: 2134, Len: 112
SSH Protocol

No.     Time        Source                Destination           Protocol Length Info
     49 78.430000   10.0.1.12             10.0.1.14             SSHv2    162    Encrypted response packet len=96

Frame 49: 162 bytes on wire (1296 bits), 162 bytes captured (1296 bits)
Ethernet II, Src: Hewlett-_c4:b4:32 (00:24:81:c4:b4:32), Dst: Hewlett-_0d:8d:55 (00:25:b3:0d:8d:55)
Internet Protocol Version 4, Src: 10.0.1.12 (10.0.1.12), Dst: 10.0.1.14 (10.0.1.14)
Transmission Control Protocol, Src Port: ssh (22), Dst Port: 42548 (42548), Seq: 2118, Ack: 2134, Len: 96
SSH Protocol

No.     Time        Source                Destination           Protocol Length Info
     50 78.430278   10.0.1.14             10.0.1.12             TCP      66     42548 > ssh [ACK] Seq=2134 Ack=2214 Win=20096 Len=0 TSval=1391932 TSecr=1336184

Frame 50: 66 bytes on wire (528 bits), 66 bytes captured (528 bits)
Ethernet II, Src: Hewlett-_0d:8d:55 (00:25:b3:0d:8d:55), Dst: Hewlett-_c4:b4:32 (00:24:81:c4:b4:32)
Internet Protocol Version 4, Src: 10.0.1.14 (10.0.1.14), Dst: 10.0.1.12 (10.0.1.12)
Transmission Control Protocol, Src Port: 42548 (42548), Dst Port: ssh (22), Seq: 2134, Ack: 2214, Len: 0

No.     Time        Source                Destination           Protocol Length Info
     51 78.513905   10.0.1.12             10.0.1.14             SSHv2    146    Encrypted response packet len=80

Frame 51: 146 bytes on wire (1168 bits), 146 bytes captured (1168 bits)
Ethernet II, Src: Hewlett-_c4:b4:32 (00:24:81:c4:b4:32), Dst: Hewlett-_0d:8d:55 (00:25:b3:0d:8d:55)
Internet Protocol Version 4, Src: 10.0.1.12 (10.0.1.12), Dst: 10.0.1.14 (10.0.1.14)
Transmission Control Protocol, Src Port: ssh (22), Dst Port: 42548 (42548), Seq: 2214, Ack: 2134, Len: 80
SSH Protocol

No.     Time        Source                Destination           Protocol Length Info
     52 78.553234   10.0.1.14             10.0.1.12             TCP      66     42548 > ssh [ACK] Seq=2134 Ack=2294 Win=20096 Len=0 TSval=1392055 TSecr=1336269

Frame 52: 66 bytes on wire (528 bits), 66 bytes captured (528 bits)
Ethernet II, Src: Hewlett-_0d:8d:55 (00:25:b3:0d:8d:55), Dst: Hewlett-_c4:b4:32 (00:24:81:c4:b4:32)
Internet Protocol Version 4, Src: 10.0.1.14 (10.0.1.14), Dst: 10.0.1.12 (10.0.1.12)
Transmission Control Protocol, Src Port: 42548 (42548), Dst Port: ssh (22), Seq: 2134, Ack: 2294, Len: 0

No.     Time        Source                Destination           Protocol Length Info
     53 80.072779   10.0.1.14             10.0.1.12             SSHv2    114    Encrypted request packet len=48

Frame 53: 114 bytes on wire (912 bits), 114 bytes captured (912 bits)
Ethernet II, Src: Hewlett-_0d:8d:55 (00:25:b3:0d:8d:55), Dst: Hewlett-_c4:b4:32 (00:24:81:c4:b4:32)
Internet Protocol Version 4, Src: 10.0.1.14 (10.0.1.14), Dst: 10.0.1.12 (10.0.1.12)
Transmission Control Protocol, Src Port: 42548 (42548), Dst Port: ssh (22), Seq: 2134, Ack: 2294, Len: 48
SSH Protocol

No.     Time        Source                Destination           Protocol Length Info
     54 80.073025   10.0.1.12             10.0.1.14             TCP      66     ssh > 42548 [ACK] Seq=2294 Ack=2182 Win=24832 Len=0 TSval=1337828 TSecr=1393574

Frame 54: 66 bytes on wire (528 bits), 66 bytes captured (528 bits)
Ethernet II, Src: Hewlett-_c4:b4:32 (00:24:81:c4:b4:32), Dst: Hewlett-_0d:8d:55 (00:25:b3:0d:8d:55)
Internet Protocol Version 4, Src: 10.0.1.12 (10.0.1.12), Dst: 10.0.1.14 (10.0.1.14)
Transmission Control Protocol, Src Port: ssh (22), Dst Port: 42548 (42548), Seq: 2294, Ack: 2182, Len: 0

No.     Time        Source                Destination           Protocol Length Info
     55 80.073028   10.0.1.12             10.0.1.14             SSHv2    114    Encrypted response packet len=48

Frame 55: 114 bytes on wire (912 bits), 114 bytes captured (912 bits)
Ethernet II, Src: Hewlett-_c4:b4:32 (00:24:81:c4:b4:32), Dst: Hewlett-_0d:8d:55 (00:25:b3:0d:8d:55)
Internet Protocol Version 4, Src: 10.0.1.12 (10.0.1.12), Dst: 10.0.1.14 (10.0.1.14)
Transmission Control Protocol, Src Port: ssh (22), Dst Port: 42548 (42548), Seq: 2294, Ack: 2182, Len: 48
SSH Protocol

No.     Time        Source                Destination           Protocol Length Info
     56 80.073276   10.0.1.14             10.0.1.12             TCP      66     42548 > ssh [ACK] Seq=2182 Ack=2342 Win=20096 Len=0 TSval=1393575 TSecr=1337829

Frame 56: 66 bytes on wire (528 bits), 66 bytes captured (528 bits)
Ethernet II, Src: Hewlett-_0d:8d:55 (00:25:b3:0d:8d:55), Dst: Hewlett-_c4:b4:32 (00:24:81:c4:b4:32)
Internet Protocol Version 4, Src: 10.0.1.14 (10.0.1.14), Dst: 10.0.1.12 (10.0.1.12)
Transmission Control Protocol, Src Port: 42548 (42548), Dst Port: ssh (22), Seq: 2182, Ack: 2342, Len: 0

No.     Time        Source                Destination           Protocol Length Info
     57 80.192652   10.0.1.14             10.0.1.12             SSHv2    114    Encrypted request packet len=48

Frame 57: 114 bytes on wire (912 bits), 114 bytes captured (912 bits)
Ethernet II, Src: Hewlett-_0d:8d:55 (00:25:b3:0d:8d:55), Dst: Hewlett-_c4:b4:32 (00:24:81:c4:b4:32)
Internet Protocol Version 4, Src: 10.0.1.14 (10.0.1.14), Dst: 10.0.1.12 (10.0.1.12)
Transmission Control Protocol, Src Port: 42548 (42548), Dst Port: ssh (22), Seq: 2182, Ack: 2342, Len: 48
SSH Protocol

No.     Time        Source                Destination           Protocol Length Info
     58 80.192999   10.0.1.12             10.0.1.14             SSHv2    114    Encrypted response packet len=48

Frame 58: 114 bytes on wire (912 bits), 114 bytes captured (912 bits)
Ethernet II, Src: Hewlett-_c4:b4:32 (00:24:81:c4:b4:32), Dst: Hewlett-_0d:8d:55 (00:25:b3:0d:8d:55)
Internet Protocol Version 4, Src: 10.0.1.12 (10.0.1.12), Dst: 10.0.1.14 (10.0.1.14)
Transmission Control Protocol, Src Port: ssh (22), Dst Port: 42548 (42548), Seq: 2342, Ack: 2230, Len: 48
SSH Protocol

No.     Time        Source                Destination           Protocol Length Info
     59 80.193272   10.0.1.14             10.0.1.12             TCP      66     42548 > ssh [ACK] Seq=2230 Ack=2390 Win=20096 Len=0 TSval=1393695 TSecr=1337948

Frame 59: 66 bytes on wire (528 bits), 66 bytes captured (528 bits)
Ethernet II, Src: Hewlett-_0d:8d:55 (00:25:b3:0d:8d:55), Dst: Hewlett-_c4:b4:32 (00:24:81:c4:b4:32)
Internet Protocol Version 4, Src: 10.0.1.14 (10.0.1.14), Dst: 10.0.1.12 (10.0.1.12)
Transmission Control Protocol, Src Port: 42548 (42548), Dst Port: ssh (22), Seq: 2230, Ack: 2390, Len: 0

No.     Time        Source                Destination           Protocol Length Info
     60 83.736946   10.0.1.14             10.0.1.12             SSHv2    114    Encrypted request packet len=48

Frame 60: 114 bytes on wire (912 bits), 114 bytes captured (912 bits)
Ethernet II, Src: Hewlett-_0d:8d:55 (00:25:b3:0d:8d:55), Dst: Hewlett-_c4:b4:32 (00:24:81:c4:b4:32)
Internet Protocol Version 4, Src: 10.0.1.14 (10.0.1.14), Dst: 10.0.1.12 (10.0.1.12)
Transmission Control Protocol, Src Port: 42548 (42548), Dst Port: ssh (22), Seq: 2230, Ack: 2390, Len: 48
SSH Protocol

No.     Time        Source                Destination           Protocol Length Info
     61 83.737192   10.0.1.12             10.0.1.14             SSHv2    114    Encrypted response packet len=48

Frame 61: 114 bytes on wire (912 bits), 114 bytes captured (912 bits)
Ethernet II, Src: Hewlett-_c4:b4:32 (00:24:81:c4:b4:32), Dst: Hewlett-_0d:8d:55 (00:25:b3:0d:8d:55)
Internet Protocol Version 4, Src: 10.0.1.12 (10.0.1.12), Dst: 10.0.1.14 (10.0.1.14)
Transmission Control Protocol, Src Port: ssh (22), Dst Port: 42548 (42548), Seq: 2390, Ack: 2278, Len: 48
SSH Protocol

No.     Time        Source                Destination           Protocol Length Info
     62 83.737442   10.0.1.14             10.0.1.12             TCP      66     42548 > ssh [ACK] Seq=2278 Ack=2438 Win=20096 Len=0 TSval=1397239 TSecr=1341493

Frame 62: 66 bytes on wire (528 bits), 66 bytes captured (528 bits)
Ethernet II, Src: Hewlett-_0d:8d:55 (00:25:b3:0d:8d:55), Dst: Hewlett-_c4:b4:32 (00:24:81:c4:b4:32)
Internet Protocol Version 4, Src: 10.0.1.14 (10.0.1.14), Dst: 10.0.1.12 (10.0.1.12)
Transmission Control Protocol, Src Port: 42548 (42548), Dst Port: ssh (22), Seq: 2278, Ack: 2438, Len: 0

No.     Time        Source                Destination           Protocol Length Info
     63 83.738704   10.0.1.12             10.0.1.14             SSHv2    306    Encrypted response packet len=240

Frame 63: 306 bytes on wire (2448 bits), 306 bytes captured (2448 bits)
Ethernet II, Src: Hewlett-_c4:b4:32 (00:24:81:c4:b4:32), Dst: Hewlett-_0d:8d:55 (00:25:b3:0d:8d:55)
Internet Protocol Version 4, Src: 10.0.1.12 (10.0.1.12), Dst: 10.0.1.14 (10.0.1.14)
Transmission Control Protocol, Src Port: ssh (22), Dst Port: 42548 (42548), Seq: 2438, Ack: 2278, Len: 240
SSH Protocol

No.     Time        Source                Destination           Protocol Length Info
     64 83.738708   10.0.1.12             10.0.1.14             SSHv2    146    Encrypted response packet len=80

Frame 64: 146 bytes on wire (1168 bits), 146 bytes captured (1168 bits)
Ethernet II, Src: Hewlett-_c4:b4:32 (00:24:81:c4:b4:32), Dst: Hewlett-_0d:8d:55 (00:25:b3:0d:8d:55)
Internet Protocol Version 4, Src: 10.0.1.12 (10.0.1.12), Dst: 10.0.1.14 (10.0.1.14)
Transmission Control Protocol, Src Port: ssh (22), Dst Port: 42548 (42548), Seq: 2678, Ack: 2278, Len: 80
SSH Protocol

No.     Time        Source                Destination           Protocol Length Info
     65 83.738970   10.0.1.14             10.0.1.12             TCP      66     42548 > ssh [ACK] Seq=2278 Ack=2678 Win=21888 Len=0 TSval=1397240 TSecr=1341494

Frame 65: 66 bytes on wire (528 bits), 66 bytes captured (528 bits)
Ethernet II, Src: Hewlett-_0d:8d:55 (00:25:b3:0d:8d:55), Dst: Hewlett-_c4:b4:32 (00:24:81:c4:b4:32)
Internet Protocol Version 4, Src: 10.0.1.14 (10.0.1.14), Dst: 10.0.1.12 (10.0.1.12)
Transmission Control Protocol, Src Port: 42548 (42548), Dst Port: ssh (22), Seq: 2278, Ack: 2678, Len: 0

No.     Time        Source                Destination           Protocol Length Info
     66 83.738973   10.0.1.14             10.0.1.12             TCP      66     42548 > ssh [ACK] Seq=2278 Ack=2758 Win=21888 Len=0 TSval=1397240 TSecr=1341494

Frame 66: 66 bytes on wire (528 bits), 66 bytes captured (528 bits)
Ethernet II, Src: Hewlett-_0d:8d:55 (00:25:b3:0d:8d:55), Dst: Hewlett-_c4:b4:32 (00:24:81:c4:b4:32)
Internet Protocol Version 4, Src: 10.0.1.14 (10.0.1.14), Dst: 10.0.1.12 (10.0.1.12)
Transmission Control Protocol, Src Port: 42548 (42548), Dst Port: ssh (22), Seq: 2278, Ack: 2758, Len: 0

No.     Time        Source                Destination           Protocol Length Info
     67 86.376848   10.0.1.14             10.0.1.12             SSHv2    114    Encrypted request packet len=48

Frame 67: 114 bytes on wire (912 bits), 114 bytes captured (912 bits)
Ethernet II, Src: Hewlett-_0d:8d:55 (00:25:b3:0d:8d:55), Dst: Hewlett-_c4:b4:32 (00:24:81:c4:b4:32)
Internet Protocol Version 4, Src: 10.0.1.14 (10.0.1.14), Dst: 10.0.1.12 (10.0.1.12)
Transmission Control Protocol, Src Port: 42548 (42548), Dst Port: ssh (22), Seq: 2278, Ack: 2758, Len: 48
SSH Protocol

No.     Time        Source                Destination           Protocol Length Info
     68 86.377283   10.0.1.12             10.0.1.14             SSHv2    114    Encrypted response packet len=48

Frame 68: 114 bytes on wire (912 bits), 114 bytes captured (912 bits)
Ethernet II, Src: Hewlett-_c4:b4:32 (00:24:81:c4:b4:32), Dst: Hewlett-_0d:8d:55 (00:25:b3:0d:8d:55)
Internet Protocol Version 4, Src: 10.0.1.12 (10.0.1.12), Dst: 10.0.1.14 (10.0.1.14)
Transmission Control Protocol, Src Port: ssh (22), Dst Port: 42548 (42548), Seq: 2758, Ack: 2326, Len: 48
SSH Protocol

No.     Time        Source                Destination           Protocol Length Info
     69 86.377558   10.0.1.14             10.0.1.12             TCP      66     42548 > ssh [ACK] Seq=2326 Ack=2806 Win=21888 Len=0 TSval=1399879 TSecr=1344133

Frame 69: 66 bytes on wire (528 bits), 66 bytes captured (528 bits)
Ethernet II, Src: Hewlett-_0d:8d:55 (00:25:b3:0d:8d:55), Dst: Hewlett-_c4:b4:32 (00:24:81:c4:b4:32)
Internet Protocol Version 4, Src: 10.0.1.14 (10.0.1.14), Dst: 10.0.1.12 (10.0.1.12)
Transmission Control Protocol, Src Port: 42548 (42548), Dst Port: ssh (22), Seq: 2326, Ack: 2806, Len: 0

No.     Time        Source                Destination           Protocol Length Info
     70 86.592741   10.0.1.14             10.0.1.12             SSHv2    114    Encrypted request packet len=48

Frame 70: 114 bytes on wire (912 bits), 114 bytes captured (912 bits)
Ethernet II, Src: Hewlett-_0d:8d:55 (00:25:b3:0d:8d:55), Dst: Hewlett-_c4:b4:32 (00:24:81:c4:b4:32)
Internet Protocol Version 4, Src: 10.0.1.14 (10.0.1.14), Dst: 10.0.1.12 (10.0.1.12)
Transmission Control Protocol, Src Port: 42548 (42548), Dst Port: ssh (22), Seq: 2326, Ack: 2806, Len: 48
SSH Protocol

No.     Time        Source                Destination           Protocol Length Info
     71 86.593086   10.0.1.12             10.0.1.14             SSHv2    114    Encrypted response packet len=48

Frame 71: 114 bytes on wire (912 bits), 114 bytes captured (912 bits)
Ethernet II, Src: Hewlett-_c4:b4:32 (00:24:81:c4:b4:32), Dst: Hewlett-_0d:8d:55 (00:25:b3:0d:8d:55)
Internet Protocol Version 4, Src: 10.0.1.12 (10.0.1.12), Dst: 10.0.1.14 (10.0.1.14)
Transmission Control Protocol, Src Port: ssh (22), Dst Port: 42548 (42548), Seq: 2806, Ack: 2374, Len: 48
SSH Protocol

No.     Time        Source                Destination           Protocol Length Info
     72 86.593361   10.0.1.14             10.0.1.12             TCP      66     42548 > ssh [ACK] Seq=2374 Ack=2854 Win=21888 Len=0 TSval=1400095 TSecr=1344348

Frame 72: 66 bytes on wire (528 bits), 66 bytes captured (528 bits)
Ethernet II, Src: Hewlett-_0d:8d:55 (00:25:b3:0d:8d:55), Dst: Hewlett-_c4:b4:32 (00:24:81:c4:b4:32)
Internet Protocol Version 4, Src: 10.0.1.14 (10.0.1.14), Dst: 10.0.1.12 (10.0.1.12)
Transmission Control Protocol, Src Port: 42548 (42548), Dst Port: ssh (22), Seq: 2374, Ack: 2854, Len: 0

No.     Time        Source                Destination           Protocol Length Info
     73 86.704882   10.0.1.14             10.0.1.12             SSHv2    114    Encrypted request packet len=48

Frame 73: 114 bytes on wire (912 bits), 114 bytes captured (912 bits)
Ethernet II, Src: Hewlett-_0d:8d:55 (00:25:b3:0d:8d:55), Dst: Hewlett-_c4:b4:32 (00:24:81:c4:b4:32)
Internet Protocol Version 4, Src: 10.0.1.14 (10.0.1.14), Dst: 10.0.1.12 (10.0.1.12)
Transmission Control Protocol, Src Port: 42548 (42548), Dst Port: ssh (22), Seq: 2374, Ack: 2854, Len: 48
SSH Protocol

No.     Time        Source                Destination           Protocol Length Info
     74 86.705229   10.0.1.12             10.0.1.14             SSHv2    114    Encrypted response packet len=48

Frame 74: 114 bytes on wire (912 bits), 114 bytes captured (912 bits)
Ethernet II, Src: Hewlett-_c4:b4:32 (00:24:81:c4:b4:32), Dst: Hewlett-_0d:8d:55 (00:25:b3:0d:8d:55)
Internet Protocol Version 4, Src: 10.0.1.12 (10.0.1.12), Dst: 10.0.1.14 (10.0.1.14)
Transmission Control Protocol, Src Port: ssh (22), Dst Port: 42548 (42548), Seq: 2854, Ack: 2422, Len: 48
SSH Protocol

No.     Time        Source                Destination           Protocol Length Info
     75 86.705502   10.0.1.14             10.0.1.12             TCP      66     42548 > ssh [ACK] Seq=2422 Ack=2902 Win=21888 Len=0 TSval=1400207 TSecr=1344461

Frame 75: 66 bytes on wire (528 bits), 66 bytes captured (528 bits)
Ethernet II, Src: Hewlett-_0d:8d:55 (00:25:b3:0d:8d:55), Dst: Hewlett-_c4:b4:32 (00:24:81:c4:b4:32)
Internet Protocol Version 4, Src: 10.0.1.14 (10.0.1.14), Dst: 10.0.1.12 (10.0.1.12)
Transmission Control Protocol, Src Port: 42548 (42548), Dst Port: ssh (22), Seq: 2422, Ack: 2902, Len: 0

No.     Time        Source                Destination           Protocol Length Info
     76 86.848826   10.0.1.14             10.0.1.12             SSHv2    114    Encrypted request packet len=48

Frame 76: 114 bytes on wire (912 bits), 114 bytes captured (912 bits)
Ethernet II, Src: Hewlett-_0d:8d:55 (00:25:b3:0d:8d:55), Dst: Hewlett-_c4:b4:32 (00:24:81:c4:b4:32)
Internet Protocol Version 4, Src: 10.0.1.14 (10.0.1.14), Dst: 10.0.1.12 (10.0.1.12)
Transmission Control Protocol, Src Port: 42548 (42548), Dst Port: ssh (22), Seq: 2422, Ack: 2902, Len: 48
SSH Protocol

No.     Time        Source                Destination           Protocol Length Info
     77 86.849130   10.0.1.12             10.0.1.14             SSHv2    114    Encrypted response packet len=48

Frame 77: 114 bytes on wire (912 bits), 114 bytes captured (912 bits)
Ethernet II, Src: Hewlett-_c4:b4:32 (00:24:81:c4:b4:32), Dst: Hewlett-_0d:8d:55 (00:25:b3:0d:8d:55)
Internet Protocol Version 4, Src: 10.0.1.12 (10.0.1.12), Dst: 10.0.1.14 (10.0.1.14)
Transmission Control Protocol, Src Port: ssh (22), Dst Port: 42548 (42548), Seq: 2902, Ack: 2470, Len: 48
SSH Protocol

No.     Time        Source                Destination           Protocol Length Info
     78 86.849406   10.0.1.14             10.0.1.12             TCP      66     42548 > ssh [ACK] Seq=2470 Ack=2950 Win=21888 Len=0 TSval=1400351 TSecr=1344605

Frame 78: 66 bytes on wire (528 bits), 66 bytes captured (528 bits)
Ethernet II, Src: Hewlett-_0d:8d:55 (00:25:b3:0d:8d:55), Dst: Hewlett-_c4:b4:32 (00:24:81:c4:b4:32)
Internet Protocol Version 4, Src: 10.0.1.14 (10.0.1.14), Dst: 10.0.1.12 (10.0.1.12)
Transmission Control Protocol, Src Port: 42548 (42548), Dst Port: ssh (22), Seq: 2470, Ack: 2950, Len: 0

No.     Time        Source                Destination           Protocol Length Info
     79 87.769190   10.0.1.14             10.0.1.12             SSHv2    114    Encrypted request packet len=48

Frame 79: 114 bytes on wire (912 bits), 114 bytes captured (912 bits)
Ethernet II, Src: Hewlett-_0d:8d:55 (00:25:b3:0d:8d:55), Dst: Hewlett-_c4:b4:32 (00:24:81:c4:b4:32)
Internet Protocol Version 4, Src: 10.0.1.14 (10.0.1.14), Dst: 10.0.1.12 (10.0.1.12)
Transmission Control Protocol, Src Port: 42548 (42548), Dst Port: ssh (22), Seq: 2470, Ack: 2950, Len: 48
SSH Protocol

No.     Time        Source                Destination           Protocol Length Info
     80 87.769613   10.0.1.12             10.0.1.14             SSHv2    114    Encrypted response packet len=48

Frame 80: 114 bytes on wire (912 bits), 114 bytes captured (912 bits)
Ethernet II, Src: Hewlett-_c4:b4:32 (00:24:81:c4:b4:32), Dst: Hewlett-_0d:8d:55 (00:25:b3:0d:8d:55)
Internet Protocol Version 4, Src: 10.0.1.12 (10.0.1.12), Dst: 10.0.1.14 (10.0.1.14)
Transmission Control Protocol, Src Port: ssh (22), Dst Port: 42548 (42548), Seq: 2950, Ack: 2518, Len: 48
SSH Protocol

No.     Time        Source                Destination           Protocol Length Info
     81 87.769616   10.0.1.12             10.0.1.14             SSHv2    114    Encrypted response packet len=48

Frame 81: 114 bytes on wire (912 bits), 114 bytes captured (912 bits)
Ethernet II, Src: Hewlett-_c4:b4:32 (00:24:81:c4:b4:32), Dst: Hewlett-_0d:8d:55 (00:25:b3:0d:8d:55)
Internet Protocol Version 4, Src: 10.0.1.12 (10.0.1.12), Dst: 10.0.1.14 (10.0.1.14)
Transmission Control Protocol, Src Port: ssh (22), Dst Port: 42548 (42548), Seq: 2998, Ack: 2518, Len: 48
SSH Protocol

No.     Time        Source                Destination           Protocol Length Info
     82 87.769862   10.0.1.14             10.0.1.12             TCP      66     42548 > ssh [ACK] Seq=2518 Ack=2998 Win=21888 Len=0 TSval=1401271 TSecr=1345525

Frame 82: 66 bytes on wire (528 bits), 66 bytes captured (528 bits)
Ethernet II, Src: Hewlett-_0d:8d:55 (00:25:b3:0d:8d:55), Dst: Hewlett-_c4:b4:32 (00:24:81:c4:b4:32)
Internet Protocol Version 4, Src: 10.0.1.14 (10.0.1.14), Dst: 10.0.1.12 (10.0.1.12)
Transmission Control Protocol, Src Port: 42548 (42548), Dst Port: ssh (22), Seq: 2518, Ack: 2998, Len: 0

No.     Time        Source                Destination           Protocol Length Info
     83 87.770113   10.0.1.14             10.0.1.12             TCP      66     42548 > ssh [ACK] Seq=2518 Ack=3046 Win=21888 Len=0 TSval=1401271 TSecr=1345525

Frame 83: 66 bytes on wire (528 bits), 66 bytes captured (528 bits)
Ethernet II, Src: Hewlett-_0d:8d:55 (00:25:b3:0d:8d:55), Dst: Hewlett-_c4:b4:32 (00:24:81:c4:b4:32)
Internet Protocol Version 4, Src: 10.0.1.14 (10.0.1.14), Dst: 10.0.1.12 (10.0.1.12)
Transmission Control Protocol, Src Port: 42548 (42548), Dst Port: ssh (22), Seq: 2518, Ack: 3046, Len: 0

No.     Time        Source                Destination           Protocol Length Info
     84 87.770909   10.0.1.12             10.0.1.14             SSHv2    258    Encrypted response packet len=192

Frame 84: 258 bytes on wire (2064 bits), 258 bytes captured (2064 bits)
Ethernet II, Src: Hewlett-_c4:b4:32 (00:24:81:c4:b4:32), Dst: Hewlett-_0d:8d:55 (00:25:b3:0d:8d:55)
Internet Protocol Version 4, Src: 10.0.1.12 (10.0.1.12), Dst: 10.0.1.14 (10.0.1.14)
Transmission Control Protocol, Src Port: ssh (22), Dst Port: 42548 (42548), Seq: 3046, Ack: 2518, Len: 192
SSH Protocol

No.     Time        Source                Destination           Protocol Length Info
     85 87.771176   10.0.1.14             10.0.1.12             TCP      66     42548 > ssh [ACK] Seq=2518 Ack=3238 Win=23680 Len=0 TSval=1401273 TSecr=1345526

Frame 85: 66 bytes on wire (528 bits), 66 bytes captured (528 bits)
Ethernet II, Src: Hewlett-_0d:8d:55 (00:25:b3:0d:8d:55), Dst: Hewlett-_c4:b4:32 (00:24:81:c4:b4:32)
Internet Protocol Version 4, Src: 10.0.1.14 (10.0.1.14), Dst: 10.0.1.12 (10.0.1.12)
Transmission Control Protocol, Src Port: 42548 (42548), Dst Port: ssh (22), Seq: 2518, Ack: 3238, Len: 0

No.     Time        Source                Destination           Protocol Length Info
     86 87.771179   10.0.1.14             10.0.1.12             SSHv2    98     Encrypted request packet len=32

Frame 86: 98 bytes on wire (784 bits), 98 bytes captured (784 bits)
Ethernet II, Src: Hewlett-_0d:8d:55 (00:25:b3:0d:8d:55), Dst: Hewlett-_c4:b4:32 (00:24:81:c4:b4:32)
Internet Protocol Version 4, Src: 10.0.1.14 (10.0.1.14), Dst: 10.0.1.12 (10.0.1.12)
Transmission Control Protocol, Src Port: 42548 (42548), Dst Port: ssh (22), Seq: 2518, Ack: 3238, Len: 32
SSH Protocol

No.     Time        Source                Destination           Protocol Length Info
     87 87.771427   10.0.1.14             10.0.1.12             SSHv2    130    Encrypted request packet len=64

Frame 87: 130 bytes on wire (1040 bits), 130 bytes captured (1040 bits)
Ethernet II, Src: Hewlett-_0d:8d:55 (00:25:b3:0d:8d:55), Dst: Hewlett-_c4:b4:32 (00:24:81:c4:b4:32)
Internet Protocol Version 4, Src: 10.0.1.14 (10.0.1.14), Dst: 10.0.1.12 (10.0.1.12)
Transmission Control Protocol, Src Port: 42548 (42548), Dst Port: ssh (22), Seq: 2550, Ack: 3238, Len: 64
SSH Protocol

No.     Time        Source                Destination           Protocol Length Info
     88 87.771430   10.0.1.14             10.0.1.12             TCP      66     42548 > ssh [FIN, ACK] Seq=2614 Ack=3238 Win=23680 Len=0 TSval=1401273 TSecr=1345526

Frame 88: 66 bytes on wire (528 bits), 66 bytes captured (528 bits)
Ethernet II, Src: Hewlett-_0d:8d:55 (00:25:b3:0d:8d:55), Dst: Hewlett-_c4:b4:32 (00:24:81:c4:b4:32)
Internet Protocol Version 4, Src: 10.0.1.14 (10.0.1.14), Dst: 10.0.1.12 (10.0.1.12)
Transmission Control Protocol, Src Port: 42548 (42548), Dst Port: ssh (22), Seq: 2614, Ack: 3238, Len: 0

No.     Time        Source                Destination           Protocol Length Info
     89 87.771716   10.0.1.12             10.0.1.14             TCP      66     ssh > 42548 [ACK] Seq=3238 Ack=2615 Win=24832 Len=0 TSval=1345527 TSecr=1401273

Frame 89: 66 bytes on wire (528 bits), 66 bytes captured (528 bits)
Ethernet II, Src: Hewlett-_c4:b4:32 (00:24:81:c4:b4:32), Dst: Hewlett-_0d:8d:55 (00:25:b3:0d:8d:55)
Internet Protocol Version 4, Src: 10.0.1.12 (10.0.1.12), Dst: 10.0.1.14 (10.0.1.14)
Transmission Control Protocol, Src Port: ssh (22), Dst Port: 42548 (42548), Seq: 3238, Ack: 2615, Len: 0

No.     Time        Source                Destination           Protocol Length Info
     90 87.773693   10.0.1.12             10.0.1.14             TCP      66     ssh > 42548 [FIN, ACK] Seq=3238 Ack=2615 Win=24832 Len=0 TSval=1345529 TSecr=1401273

Frame 90: 66 bytes on wire (528 bits), 66 bytes captured (528 bits)
Ethernet II, Src: Hewlett-_c4:b4:32 (00:24:81:c4:b4:32), Dst: Hewlett-_0d:8d:55 (00:25:b3:0d:8d:55)
Internet Protocol Version 4, Src: 10.0.1.12 (10.0.1.12), Dst: 10.0.1.14 (10.0.1.14)
Transmission Control Protocol, Src Port: ssh (22), Dst Port: 42548 (42548), Seq: 3238, Ack: 2615, Len: 0

No.     Time        Source                Destination           Protocol Length Info
     91 87.773972   10.0.1.14             10.0.1.12             TCP      66     42548 > ssh [ACK] Seq=2615 Ack=3239 Win=23680 Len=0 TSval=1401275 TSecr=1345529

Frame 91: 66 bytes on wire (528 bits), 66 bytes captured (528 bits)
Ethernet II, Src: Hewlett-_0d:8d:55 (00:25:b3:0d:8d:55), Dst: Hewlett-_c4:b4:32 (00:24:81:c4:b4:32)
Internet Protocol Version 4, Src: 10.0.1.14 (10.0.1.14), Dst: 10.0.1.12 (10.0.1.12)
Transmission Control Protocol, Src Port: 42548 (42548), Dst Port: ssh (22), Seq: 2615, Ack: 3239, Len: 0
